,location,content,rating,date
141,Purpa_Fine_Art_Gallery_Seminyak,"Its wonderful art painting there,Ari love the art very much, she try to support local artist.She love creative people. the gallery have choose the best artist.If you have holiday at Bali, please do not miss it",5.0 of 5 bubbles,"Written July 24, 2016"
142,Eat_Street,Lots of choices to eat but can get very busy later in the night we when around 7pm and it was hard to get a seat a some of the more popular restuarants,5.0 of 5 bubbles,"Written April 25, 2020"
143,Eat_Street,Eat Street in Seminyak has a vast array of restaurants. From Greek to Italian but my preference is all ways local Indonesian food. Not cheap but it is the trendy area. Plenty of bars also.It’s location is next to Seminyak Square. Worth a visit. I prefer to eat in the quieter areas,4.0 of 5 bubbles,"Written March 6, 2020"
144,Eat_Street,"You can find the best restaurants,bars,cafes and boutiques on this street,that is why it’s always very busy.Prepare yourself for the very slow traffic,especially around the Favela area.",5.0 of 5 bubbles,"Written February 21, 2020"
145,Eat_Street,"Without doubt, this is the main focal point and is right in the middle of town. We found ourselves there on many occasions and used it a lot.There are many fashionable shops which aren’t really to our taste but will be popular with some. We used it mainly for its many convenience stores, bars and restaurants.Of the latter there are lots and across many different types of cuisine. Most are pretty good but don’t be afraid to wander up the other gangs and find local places as well.The traffic is incessant so do be careful as you cross the road. Motorbikes seem to choose whether they want to go the wrong way or onpavements frequently so look both ways!",4.0 of 5 bubbles,"Written February 14, 2020"
146,Eat_Street,"I stayed near here and it was really close to walk here (and safe). Lots of boutique shops, restaurants and cafes. And a couple of markets at the corners.",5.0 of 5 bubbles,"Written February 11, 2020"
147,Eat_Street,"We ate at several restaurants in this street including Ginger Moon and Batik, both offered great menus and delicious food.Would recommend trying both",5.0 of 5 bubbles,"Written February 10, 2020"
148,Eat_Street,"Great street with full of life. Entertainment, shopping, dining and walking. lots of spas and supermarkets as well. Great place to meet new friends. you can walk the whole street.",5.0 of 5 bubbles,"Written January 14, 2020"
149,Eat_Street,The area is a great place to either go and eat or just simply walk up and down taking in the various smells and sites. If you cant find something you want here then you wont find it.,4.0 of 5 bubbles,"Written January 7, 2020"
150,Eat_Street,nice verity of places to ear and have a few drinks without going to crazy in night club atmosphere. easy to walk around and have a nice dinner... shopping...,4.0 of 5 bubbles,"Written December 23, 2019"
151,Eat_Street,Good place to wander around and lots of choices of eating places and other shops for all ages.  Fully recommend a visit.,5.0 of 5 bubbles,"Written December 9, 2019"
152,Eat_Street,"The entire stretch of food street is lined with Cafes, Restaurants, Shops & Spas - spoilt for choice!",5.0 of 5 bubbles,"Written November 30, 2019"
153,Eat_Street,Lots of excellent dining options and of course shopping😍.Vibrant and fun place on and evening and lovely to stroll around during the day.,5.0 of 5 bubbles,"Written November 23, 2019"
154,Eat_Street,"We walked down that street every night we were there, and truly enjoyed all of the options available. Local food, Westernized food, and so many small little eateries.",4.0 of 5 bubbles,"Written November 18, 2019"
155,Eat_Street,Its a busy street with tourists offering plenty of places for food and drinks. we enjoyed walking down this street and trying out some local cuisines. It was also nice to have a few beers while people watching.,4.0 of 5 bubbles,"Written October 8, 2019"
156,Eat_Street,"A busy street with plenty of places to choose a meal from.  Cold beer, wine and cocktails served from most top class restaurants. Do not hesitate to visit this lively location.",5.0 of 5 bubbles,"Written October 6, 2019"
157,Eat_Street,"This year we ate most lunch and dinners here during our 7 night stay. We tried different restaurants most days, and were never disappointed. We particularly liked Cafe Bali, Ginger Moon, Kuni's Japanese, and the Italian Job.Cafe Bali has a daily lunch and Dinner special, and we tried this a few times and were impressed with the tastes and the value!",4.0 of 5 bubbles,"Written September 21, 2019"
158,Eat_Street,We are regulars to eat street but since our last visit july 2018 it has changed no trattoria &  replaced with another attempt at up market dining and what a disaster that is ! But in general the whole of eat street has lost something and what a shame it is ! Hopefully they can pick up their act and return to the former atmosphere and great dining,3.0 of 5 bubbles,"Written July 31, 2019"
159,Eat_Street,"Eat Street is a great place to be as there are so many bars and restaurants, with a wide variety of  different cuisines .",5.0 of 5 bubbles,"Written July 3, 2019"
160,Eat_Street,"This is a great vibey street with a lot of restaurants, cafés and little shops.  Worth taking the time for a late afternoon stroll.",5.0 of 5 bubbles,"Written May 31, 2019"
161,Eat_Street,"If you are looking for a great variety of cuisines to choose from head to Jl. Kaye Aya, Seminyak aka ‘eat street’. Here you will find a tempting array of restaurants offering menus from around the world Indonesian, Greek, Asian, fusion, - almost every palate can be satisfied. Head off the beaten track and you will come across some treasures. Favourite food Ginger Moon, earth cafe and Mykonos.",5.0 of 5 bubbles,"Written May 31, 2019"
162,Eat_Street,"We walked along this street every day and there are loads of restaurant to choose from, some are very upmarket just check the menus out front. We had dinner at Italian job really nice, coffee at sisterfields & Starbucks all safe & clean. So much to choose from. There are market shops and boutique along the street so there is all way some thing to look at.",5.0 of 5 bubbles,"Written April 28, 2019"
163,Eat_Street,"Head to Eat Street and you will find Italian, Greek, Asian, Asian fusion, seafood and almost anything else your heart desires.  There are also some hidden gems off Eat Street, such as Kilo and a killer Brazillian BBQ restaurant that are well worth a look.",5.0 of 5 bubbles,"Written April 25, 2019"
164,Eat_Street,"I created this listing after struggling to find the famous ""Eat Street"". The locals dont call it that so directions were hard to find.Ask the driver for Seminyak Square and walk towards the medical centre (East).Our favorites were Ultimo and Ginger Moon, but there are plenty to try. Boutique shops are also on offer. Enjoy!",5.0 of 5 bubbles,"Written April 15, 2019"
165,Seminyak_Village,"Very bad place.. i carried  my dog in , and the security treated me like a thief keep following me to go out even after i said i will go out.. he kept on following..",1.0 of 5 bubbles,"Written December 27, 2021"
166,Seminyak_Village,A small shopping mall. I didn’t expect inside of the mall is so smal i just seem H&M in the second floor and didn’t see something good to bought. But it’s okay because in front of the mall i found best place for brunch! It’s made  my day better,4.0 of 5 bubbles,"Written November 30, 2021"
167,Seminyak_Village,"This place is a tourist trap. I took the Kura Kura bus here. I was expecting a large shopping center with many stores. I was a little let down. There is only a handful of stores here on 2 levels. I walked around here in 5 minutes. The best thing was how modern it was and the air conditioner was top noch. What I did like was the rooftop,  had decent views of Seminyak. Iv'e never been to a shopping center that had this.",3.0 of 5 bubbles,"Written March 14, 2020"
168,Seminyak_Village,"Stupidly overpriced.  We were quoted almost 4 time’s the price for a pair of shoes.  ATM here is ok, air con is welcome relief, all shops even H&M are top tourist $$$$$",2.0 of 5 bubbles,"Written February 23, 2020"
169,Seminyak_Village,Few shops with good selection especially the H&M store. We live the candy store on the main entrance.,4.0 of 5 bubbles,"Written February 16, 2020"
170,Seminyak_Village,"If you like shopping back at home this could be a good option for an hour or so for you. It is easily accessible at the end of the main street and has lots of parking on site.Along with many of the well-known international and Australian brands there are some other more interesting shops as well.In truth, we don’t like shopping that much so I was was a quick visit. If nothing else, and it cooled us down from the searing heat outside!",2.0 of 5 bubbles,"Written February 14, 2020"
171,Seminyak_Village,"Poor management for shopping mall. Refused entry over a cup of coffee, which is unusual for any mall. I can understand not bringing outside food or drink into a restaurant. But for a mall? The shops are not even any good, things are more expensive. Only good for aircon and the loo. Wont revisit again.",2.0 of 5 bubbles,"Written February 3, 2020"
172,Seminyak_Village,"Semiyak Village and Seniyak Square are close to each other. After the heat at the Flea market  we were delighted to find this small mall (with good air con).  A good number of international brands / better quality items, of course price is also a lot expensive.",4.0 of 5 bubbles,"Written January 30, 2020"
173,Seminyak_Village,"A smallish shopping mall, with a reasonable variety of shops.  During January, there are still small stalls in the foyer, selling local crafts.  More are upstairs.  The shops are similar to those in any other mall.  A huge sweet shop, selling Hershey amongs other goodies, is on the left as you enter.  There is security at the Mall entrance, so expect your bags to be ""wanded"".",3.0 of 5 bubbles,"Written January 26, 2020"
174,Seminyak_Village,Everywhere needs a shopping mall and this 2 story mall is Bali's answer. THe mall is air conditioned and used to have a cafe on the corner where you could grab a bite and a drink however it has recently closed and awaiting a new shop. There is not a lot of variation and the prices are dearer than in the streets but it is still a nice place to stroll and cool down.,4.0 of 5 bubbles,"Written January 9, 2020"
175,Seminyak_Village,The village is a group of shops & restaurants where you can find many food options with nice views & many shopping options,4.0 of 5 bubbles,"Written January 3, 2020"
176,Seminyak_Village,"This is a small and below average mall. It is only good for air conditioning and the loo. Otherwise, they sell expensive goods. We saw that % Arabica is opening at the entrance area so it might attract more tourists once it opens.",3.0 of 5 bubbles,"Written November 21, 2019"
177,Seminyak_Village,Its a small shopping mall and targeting tourists. Most of the items are overpriced. The big store here are H&M and Candy Empire.,3.0 of 5 bubbles,"Written November 13, 2019"
178,Seminyak_Village,Don't spend valuable time here when there are so many better stores and places in Seminyak. The stores are mostly clothes or souvenir trinkets and more expensive than anywhere else.,2.0 of 5 bubbles,"Written October 14, 2019"
179,Seminyak_Village,"It is a newly made shopping mall.The design & pattern of the building is interesting.It is not a huge shopping mall.Generally,international branded items are sold here,local items are also there.One may pass sometime in evening.There is a problem of car parking",4.0 of 5 bubbles,"Written September 16, 2019"
180,Seminyak_Village,"Many bars, discoes and restaurants. A place for entertaining young people who like noise , confusion, drinking ...",1.0 of 5 bubbles,"Written September 13, 2019"
181,Seminyak_Village,"Worth visiting as it is central to Seminyak. Is much smaller than most countries malls / shopping centres,  would recommend walking the surrounding blocks.",3.0 of 5 bubbles,"Written September 12, 2019"
182,Seminyak_Village,"Not a big range of shops, but what is there is quality and worth shopping.  Huge chocolate shop. Very clean.",5.0 of 5 bubbles,"Written August 12, 2019"
183,Seminyak_Village,"Went to H&M because the only closest one from home. Was hoping to see another good store, but only few stores that interesting for me. My first time going there. I also looking for restaurants or food court, but didnt find one",4.0 of 5 bubbles,"Written July 3, 2019"
184,Seminyak_Village,"A great little shopping mall, lots of interesting shops and jewellery stands with heaps of shiny trinkets to choose from. Upstairs there's H&M and there's a lovely restaurant as well. I really enjoyed shopping there and will definitely go there again.",4.0 of 5 bubbles,"Written April 20, 2019"
185,Seminyak_Village,"Not many shops, although H&M just moved in and looks like other shops being built. Nice  stop to get out of the heat for awhile",4.0 of 5 bubbles,"Written March 4, 2019"
186,Seminyak_Village,"Visited this mall in February,though it is the last day of Chinese New Year,still can see its CNY decorations,took some photos here,and shopped here also,though not many shops compare to huge mall,but a nice experince,not crowded ,bought a souvenir at Tamara Danielle,also handmade soaps at the pantry.it is another western style shopping mall in Seminyak,have a look if you are free.",4.0 of 5 bubbles,"Written January 11, 2019"
187,Seminyak_Village,This little shopping village in Seminyak is worth a visit. It has fabulous air conditioning and some great little gift shops. You can get an icecream. It is a lovely morning outing for a couple of hours and you can get a bluebird taxi from the door.,4.0 of 5 bubbles,"Written January 6, 2019"
188,Seminyak_Village,"This was the last stop on our shopping & browsing excursions. Its a nice shopping complex with a good range of shops on the Ground and First Floors; we didn't visit the Rooftop. The problem that both my wife and I encounter is that nearly all shops are targeting the younger customer, and, in my case no men's outlet stocks sizes for the larger frame. I got a bit excited when I spotted some attractive shirts at a stall on the Ground Floor. The attendant was very helpful but, alas, the shirts were only sized to 5XL. I fit a 5XL but it seems that there are different sizes in 5XL - American, European, Asian; it just beggars credibility that a 5XL may not be a 5XL. The antique shop had some interesting items but we demurred. We took the escalator to the First Floor and encountered the screening around the future H & M outlet. It certainly impedes access to the other tenancies, none were busy. We enjoyed refreshments at Warung and headed back to our hotel. AC was excellent and refreshing after the humidity outside. The entire complex, including restrooms, were meticulously clean.",5.0 of 5 bubbles,"Written December 13, 2018"
189,Seminyak_Village,"The mall is nice with wide corridors, bright atmosphere and clean toilets. The hi-end international brands shops were pretty quiet, may be due to the pricing. The local/Indonesian designers might serve better to attract crowds. I like the antique store on the second floor and the rest of tenants on that floor was just not attractive enough. I spent closed to a million rupiah in the mall which can be used for a free shuttle to my hotel. It was a nice touch.",5.0 of 5 bubbles,"Written November 29, 2018"
190,Seminyak_Village,Lovely shopping centre. Was extremely grateful to get out of the heat. Lovely shops and staff were very friendly,2.0 of 5 bubbles,"Written October 19, 2018"
191,Seminyak_Village,Went here for a look around it's not that large has two floors but the prices are very high for what it is. Buying in London would be cheaper.,2.0 of 5 bubbles,"Written October 18, 2018"
192,Seminyak_Village,"This shopping centre is 2 storeys with a third with nothing on, which has overpriced shops in it.Not really worth a visit.However, the stalls and ships at the side of it, as worth a visit. Good souvenir and bargin shopping in both the shops and stalls. Word of caution, the coffee shops do not have there own toilets, so you have to use the centre ones.",5.0 of 5 bubbles,"Written October 8, 2018"
193,Seminyak_Village,Very new small shopping centre with lots of high end shops selling very expensive goods. Its worth a walk through as its air conditioned.,3.0 of 5 bubbles,"Written September 30, 2018"
194,Seminyak_Village,"They sell art crafts similar like the ones along the street but better quality, pretty and some which you couldnt find along the street but it comes with a price tag. Pretty interior, comfortable as escape from blistering heat outside. I also enjoyed art exhibition in one of the shop lot at the grd floor. Have a grocery store if one intends to buy some food stock.",4.0 of 5 bubbles,"Written September 21, 2018"
195,Nacivet_Art_Gallery,We bought a couple of photos of locals. They will blow up any size photos to a larger painting size and also put it in a travelling tube. Prices can vary but overall not to bad. Plenty of photos to view.,4.0 of 5 bubbles,"Written January 7, 2020"
196,Nacivet_Art_Gallery,"my partner loves art so we just quickly browsed here. Many different Art Deco paintings to browse from and also some nice trinkets to purchase, we did!",3.0 of 5 bubbles,"Written September 15, 2019"
197,Nacivet_Art_Gallery,"Gallery selling photography postcards to huge enlargements . Beautiful photos of landscapes, people , artistic nudes are on display and for sale . Photos are mainly shot by a French photographer in Bali but also from other countries. If you are interested in photography , arts 🎭 it’s definitely worth a visit to buy a photo/s worthy of framing and displaying . Recommended .",4.0 of 5 bubbles,"Written September 11, 2019"
198,Nacivet_Art_Gallery,This gallery is full of interesting pictures that help remember to visit to Bali. Many of the prints are available in a variety of sizes and are reasonably priced.As the gallery was nearly opposite our hotel we paid serval visits to the gallery the one item I would have loved to have brought back but were unfortunately out of my price bracket was one of the globe which are made out of misshaped pieces of wood with what appears to be a metal core which allows them to float on a small base and allows the globe to me moved in any direction. The sea areas are a variety of countries whilst the land masses are polished wood.  Price was about £300.,5.0 of 5 bubbles,"Written August 7, 2019"
199,Nacivet_Art_Gallery,"Nacivet was one of my favorite photographer and i didn't had any Idea about his chain shops in Bali, at the first time when i was walking in the Seminyak street i sow this shop and definitely i went inside to check what they have, then i recognize it is the Nacivet Gallery, i was shocked, just go to have a look, you are not coming out empty hand for sure.",5.0 of 5 bubbles,"Written November 15, 2018"
200,Nacivet_Art_Gallery,"Lovely shots of Bali and portraits in black and white and colour, small prints only 130k and are buy 5 get 1 free Recommend a visit They sell without frame but come with picture mount",5.0 of 5 bubbles,"Written October 17, 2018"
201,Nacivet_Art_Gallery,"The Gallery has some lovely prints and also other interest pottery  and the staff were very friendly the pictures are also unframed which is good as you can choose your own frames if you wish when you return home. They also have a good variety of different pictures , very nicely presented shop and you are able to look with out been hassled.",5.0 of 5 bubbles,"Written July 15, 2018"
202,Nacivet_Art_Gallery,The photos are so beautiful. Real photos of real people from this beautiful country. It is a must see. you won't be disappointed.,5.0 of 5 bubbles,"Written June 25, 2018"
203,Nacivet_Art_Gallery,"Picked up 3 little photographs on our last trip.  Great options and pleasant staff, happy to assist.  A good spot for a different type of Bali gift.",5.0 of 5 bubbles,"Written March 4, 2018"
204,Nacivet_Art_Gallery,"if you love art then it is another gallery to visit at seminyak, one can see various art forms here...",5.0 of 5 bubbles,"Written July 16, 2017"
205,Nacivet_Art_Gallery,Staff were very friendly and knowledgable.  The woman in charge was very helpful and kind.  We bought some wooden globes and will be sure to keep the relationship strong.,5.0 of 5 bubbles,"Written July 9, 2017"
206,Nacivet_Art_Gallery,"Ist a small shop dedicated to only one photographer, but he has a huge variety of styles. This is a nice glimpse on Balinese culture 40 years ago. He also made very artistic nudes of Balinese women which had a long tradition of working topless.You can spend 10 - 30 minutes here, so maybe not worth coming here from kuta, but definitely worth a stop when you're close by.Also no-one will try to sell you anything, so you can look at the pictures on peace.",5.0 of 5 bubbles,"Written June 28, 2017"
207,Nacivet_Art_Gallery,"Nacivet Art Gallery specializes in photography mainly of a Frenchman who has travelled all over the region recording what he sees. Photos are arranged by subject matter; flowers, nudes etc.",4.0 of 5 bubbles,"Written May 16, 2017"
208,Nacivet_Art_Gallery,"Beautiful works of art.Mostly taken by a French photographer and the photos are of various places in SE Asia, but Bali does feature.  Lovely portraits of older and younger people.  Also some lovely landscape photography.Very gifted.  Staff very helpful and not at all pushy.I believe there is more than one shop in Seminyak.",5.0 of 5 bubbles,"Written May 6, 2017"
209,Nacivet_Art_Gallery,Mainly a photographic gallery featuring a French photographer. Lots of pictures of local Bali and beautiful Balinese women.,4.0 of 5 bubbles,"Written March 30, 2017"
210,Nacivet_Art_Gallery,"This company was fantastic and we had SWETA as our driver and he was excellent, we had him for the day and went to Bedugal and Ubud, it was a great day",5.0 of 5 bubbles,"Written March 11, 2017"
211,Nacivet_Art_Gallery,"After walking past this gallery several times, I just had to go inside. So many beautiful photos of people & places from PNG and Cambodia. Even some of Balinese children. All the photos  of children were quite charming and the ones of older men and women were so full of character. I ended up buying a smaller version of each and will enjoy them hanging in my home for years to come.",5.0 of 5 bubbles,"Written August 13, 2016"
212,Nacivet_Art_Gallery,"I happen to visit this place by chance , where I was searching for café, I ended up here, this is one of small gallery in seminyak, where as its a nice gallery to enjoy and place , there are many art pieces here and can be enjoyed for a while",5.0 of 5 bubbles,"Written July 31, 2016"
213,Nacivet_Art_Gallery,"I purchased a large piece of photography that i loved! Service was fantastic, prices good - they had my artwork packaged for travel within 2 hours.",5.0 of 5 bubbles,"Written July 7, 2016"
214,Seminyak_Square,This is square is walking distance from the resort. There are few shops inside the mall and it is very clean. There are plenty of restaurants are bars are near the square. It is very lively during the evening and nights. If you are driving around you can get stuck in traffic for long time.,5.0 of 5 bubbles,"Written May 12, 2020"
215,Seminyak_Square,Shops outside designer wear all expensive. Had markets opposite but starting prices stupid!! Understand barter system but standing in the heat just too much. Did buy sunnies but only because we knew bottom price from other stalls. She quickly matched what we wanted to pay. Bought fresh wraps $4.40 AUD rolls from The Bakery BUT watch plus plus price not advertised.,3.0 of 5 bubbles,"Written March 13, 2020"
216,Seminyak_Square,First time I’ve stayed in the vicinity of Seminyak square and would highly recommend positioning yourself here. Close to shopping and great restaurants,4.0 of 5 bubbles,"Written March 3, 2020"
217,Seminyak_Square,"Seminyak Square is a shopping place which is handy if you are staying in the area.A lot of the shops are aimed at tourists, handy for buying sovenirs.Also there are several places to eat.",3.0 of 5 bubbles,"Written February 29, 2020"
218,Seminyak_Square,I loved this mall type shopping square. A wide variety of things to buy ranging from from souvenirs to food.,5.0 of 5 bubbles,"Written February 12, 2020"
219,Seminyak_Square,"This busy place is definitely the focal point of the town and there is always something happening. It gets really busy in the evening but seems to be pretty much a 24-hour the day place.It offers high class shops, fleamarket type stalls and plenty of parking.There are also a couple of pretty decent bars and restaurants around and, of course, a big shopping mall.",4.0 of 5 bubbles,"Written February 12, 2020"
220,Seminyak_Square,"Seminyak Square has a market in the centre of the square, which is ok. The shopping centre had a nice selection of shops, thank goodness for the air conditioning, it was so humid outside. There was a gelati stall and I will say, the gelato was absolutely amazing, so fresh and tasty. This is quite a busy area and there is lots of shops and bars in surrounding streets. Don't forget to get a picture with the I❤️Bali sign.",4.0 of 5 bubbles,"Written January 29, 2020"
221,Seminyak_Square,"It is a very tidy and clean shopping mall, you should come here walk around. There have many restaurants, bars and local brand clothing stores surrounding it. It is a good place to kill some time!",4.0 of 5 bubbles,"Written January 14, 2020"
