,location,content,rating,date
294,The_Flea_Market_Seminyak,"As I was exploring the Kayu Aya village along with a friend I came across this small flea market close to the Oberoi hotel. It was around 7 pm and most of the stalls are closed and there were very few visitors. I went inside and saw the stalls that are selling embroidered dresses, leather goods, unique sarongs, bags, paintings etc. There is also a huge area on the backside of the market where there are different food joints.",4.0 of 5 bubbles,"Written March 4, 2019"
295,The_Flea_Market_Seminyak,"I visit this market every visit to Bali because I think the dresses are made from more unique fabrics and there is always something special you pick up that you can't get everywhere else. It's got wide walkways, it's undercover (tents) and the vendors don't hassle you as much (but they still hassle!)...........not too big either, so not overwhelming.",5.0 of 5 bubbles,"Written January 22, 2019"
296,The_Flea_Market_Seminyak,I can proudly say that the best flea markets that I have ever come across (both in terms of items on sale and prices) were in South Africa. I visited both Johannesburg and Cape Town and shopped my heart's content on handicraft goods made by the locals. Bali comes close second. However the major difference was in prices. I found the items heavily priced here. However if you are good in bargaining skills you can get lucky. Needless to say that the items were of really good quality.,4.0 of 5 bubbles,"Written December 16, 2018"
297,The_Flea_Market_Seminyak,"I don't see any difference between shops in this market than other shops aorund Kuta and Seminyak. They always sell cheap stuff with expensive price. I know I can haggle, but I don't wanna waste my time and energy.",3.0 of 5 bubbles,"Written December 3, 2018"
298,The_Flea_Market_Seminyak,Great shopping but need to be strong with your bargaining skills some vendors can be hard to hackle with but if you stick to your guns you will achieve the price you are after.Great atmosphere friendly people.,5.0 of 5 bubbles,"Written November 29, 2018"
299,The_Flea_Market_Seminyak,"Large variety of ladies items like dresses-handbags etc, Stall holders happy to barter however know your prices and dont offend by too low prices as stall holder will walk away",5.0 of 5 bubbles,"Written November 6, 2018"
300,The_Flea_Market_Seminyak,"Small markets, traffic is terrible to get there. Prices are very expensive and very hard to haggle. Stall holders not as friendly as other places. Wouldn't go again.",2.0 of 5 bubbles,"Written October 21, 2018"
301,The_Flea_Market_Seminyak,"A great selection of stuff, my girlfriend was in seventh heaven. The vendors were pretty relaxed which I appreciate and its very close to lots of the best restaurants in semingyak.",5.0 of 5 bubbles,"Written October 19, 2018"
302,The_Flea_Market_Seminyak,"Came across this place on one of our walks.  The market is not as big as I thought it will be.  Clothing quality is decent I guess. Haggling skills required though as they do start at a high price. We managed to get 5 bits of clothing and several ornaments for under 300k IDR.  Shop around first at nearby local stalls to get an idea of pricing.  If you know what you want to pay and happy to part with that price in mind, go in ask price, barter with your bottom dollar and work your way up to what you intended to pay for them.  If they don't agree with that simply have cash in hand and show it to them.  Attempt to force the cash in there direction. If they don't accept then walk out.   They will lower their dollar closer to your intended purchase price as you leave.  Keep to your guns and still wave the cash about.  Return back to the stall 5 to 10 mins and greet them. Show cash in hand again and ask if they want to make sale.  9/10 they will accept offer or they will better there asking price for 10000 more on top. At the end of the day, $1 wouldn't affect your wallet.  A win win for everybody. I'll keep looking for other markets in the area though.",3.0 of 5 bubbles,"Written October 17, 2018"
303,The_Flea_Market_Seminyak,We hired a driver to take us to the market and it was our one regret for the trip. Traffic to get there was terrible and when we arrived underwhelmed by small number of stores. Prices double of art markets in legian etc even our driver said it would be better to shop elsewhere. Stall holders start with high price and not interested in offering much lower I think they just wait for rich people visiting seminyak to come and pay the first price they ask for. Not a huge variety everything you can find elsewhere. Wouldnt bother,2.0 of 5 bubbles,"Written October 15, 2018"
304,The_Flea_Market_Seminyak,"Good markets, good variety and good prices. Very quite at the time we went. Smallish (only need 30 Mins there) but good stuff",5.0 of 5 bubbles,"Written October 9, 2018"
305,The_Flea_Market_Seminyak,"The prices are too high. One set of magnets (5 pieces) are at 100k. You can bargain but won't get it for 14k. The prices are ridiculously expensive! Go to Agung Oleh Oleh Bali, not so far from the flea market. Prices are pretty cheap (14k for 5 pieces of magnets).",1.0 of 5 bubbles,"Written October 8, 2018"
306,The_Flea_Market_Seminyak,Don’t waste your time.. Rude unpleasant sellers. No fun shopping at a flea market where the prices start so high..you don’t even want to attempt to bargain..Now I know why the place is empty...,1.0 of 5 bubbles,"Written September 9, 2018"
307,The_Flea_Market_Seminyak,"These are small markets , if you’re in the area make a visit. There’s nothing outstanding there, and one particular stall holder had a real chip on her shoulders. There was a decent Bob Marley stall if that’s your thing.",3.0 of 5 bubbles,"Written August 27, 2018"
308,The_Flea_Market_Seminyak,"Can buy things at a bargained price. It's good to have a localite accompany while shopping, coz, they quote a high price and ask for an amount which is still higher than the market price. Little smartness is needed.",4.0 of 5 bubbles,"Written August 7, 2018"
309,The_Flea_Market_Seminyak,We come here at least once every trip to bali small but the quality is far better then the other markets you pay a little more but as i said the quality is well worth the extra,5.0 of 5 bubbles,"Written July 31, 2018"
310,The_Flea_Market_Seminyak,"Bought coconut kalimba from here. Each cost rupiah 200,000. We managed to get a discount to 150,000. If you walk down the road to buy from a souvenir shop (shown in picture), it cost only rupiah 70,000. Yes double the price.Please check on the tunes.. they do not play the same tunes. Some are bad, not sure if the sounds can be adjusted via the screws. The dream catcher is however beautiful.",2.0 of 5 bubbles,"Written July 26, 2018"
311,The_Flea_Market_Seminyak,Small flea market with limited variety things to buy and see. It was quiet with not many customers. I passed by on my way to Ku De Ta. Don’t need to make a trip down.,2.0 of 5 bubbles,"Written July 1, 2018"
312,The_Flea_Market_Seminyak,"Prices are inflated and not too many shops. Everyone is pretty much selling the same thing with inflated prices. Area is near a bunch of tourist restaurants and pricey shops so not surprised. If your going to go to a night market or shop in the seminyak area, I would recommend Senggol Market Night Market on Google maps... There are tourist shops as well but prices are much cheaper for clothing and souvenir and there's a lot more to do and see. Also has local restaurants with cheap food.",2.0 of 5 bubbles,"Written June 21, 2018"
313,The_Flea_Market_Seminyak,small market and selling same stuff that are available all over the country. bags / wooden items / clothes / artificial jewellery ---- nothing new !!,3.0 of 5 bubbles,"Written June 18, 2018"
314,The_Flea_Market_Seminyak,Came to look around and not much to say. Its just a market with a few rows of stalls. Its exactly what you think it would be. Items in stalls repeat themselves. Its good value for money but you must haggle. Worth going if you want to pick up some cheap items/souveniers,3.0 of 5 bubbles,"Written June 15, 2018"
315,The_Flea_Market_Seminyak,"Very small market, under plastic so it feels about 1,000 degrees! They're all very similar stalls selling basically the same things. It's more laid back than Seminyak Square market, but we were in and out very quickly as there wasn't much to see.",3.0 of 5 bubbles,"Written June 7, 2018"
316,The_Flea_Market_Seminyak,"The market was overpriced and they had minimal sizes - the one fits all size which does not fit well with me.  The quality of products as well was not that great.  For me personally it was not worth visiting, the overhead cover does not protect you from the sun actually it keeps in the heat which made shopping even more tedious.",2.0 of 5 bubbles,"Written June 3, 2018"
317,The_Flea_Market_Seminyak,"Bigger market than Seminyak square but similar sort of stuff. Towels, clothes etc. Some of them can be a bit rude and you need to have a really good barter as the prices start quite high.",4.0 of 5 bubbles,"Written June 2, 2018"
318,The_Flea_Market_Seminyak,"I’ve been to these markets a few times with friends to pick up bits and pieces.As expected it’s generally all the same items that you find in the other stores but all in one place with multiple market stands.Let’s face it, no matter where you go the bartering starts high and therein lies the challenge of getting back to what you are happy to pay. Bearing in mind you are probably only bartering over a few dollars from an Australian perspective. Generally I’ve found if you know how to barter and have a bit of fun, plus a walk away point you will generally get away with a better price than the shops and tourist stores... just be firm but at the end of the day they are out to earn money too :)I wouldn’t head there if you’ve had a long day or in a cranky mood as you will get nowhere but definitely worth a look in. Remember you don’t have to buy, if you can’t get them to the price you want then head to the next stall holder, albeit that means starting the process again.Have fun!",4.0 of 5 bubbles,"Written May 25, 2018"
319,The_Flea_Market_Seminyak,Lots of stuff you see everywhere. Can be a bit draining with every single vendor calling out to you. Don’t stress if you miss this one.,3.0 of 5 bubbles,"Written May 7, 2018"
320,The_Flea_Market_Seminyak,"PRiced quite high, barely budging and lack of variety. ITs close to Seminyak square and hence the steep prices. Basic handicrafts, wooden items and women's tops. Nothing excitng worth making a trip for.",3.0 of 5 bubbles,"Written April 5, 2018"
321,Buddha_Gallery,this is a well set out shop with lots of different Buddha's from differing places including places like Vietnam. Pricey but well worth a look. Nicely displayed,4.0 of 5 bubbles,"Written February 9, 2018"
322,Buddha_Gallery,Those interested in art and sculpture may find a few interesting things to see here. would recommend only if you have too much time to kill.,4.0 of 5 bubbles,"Written January 19, 2018"
323,Buddha_Gallery,"Excellent small shop-museum, the Buddha Gallery has some very interesting Buddha paraphenalia - recommended.",4.0 of 5 bubbles,"Written November 24, 2017"
324,Buddha_Gallery,Buddha Gallery is a small shop and has a number of very fine old Buddhas as well as museum quality Buddha artifacts. The prices are eye-watering and there's nothing here for the casual shopper wanting to take home a small souvenir.,4.0 of 5 bubbles,"Written May 5, 2017"
325,Buddha_Gallery,Real nice shop/museum with a lot of Buddha related items. Some are real beautiful. Pitty that our language is to small.  They had some real nice pictures and statues that a would like to bye.,4.0 of 5 bubbles,"Written March 19, 2016"
326,Buddha_Gallery,"A nice shop with antique Buddha's and nik naks. We were looking to buy a large (up to 6 foot high) Buddha so were excited when we saw this shop on trip advisor. The shop is small and is very expensive as most stock is antique so if you are looking for an average priced piece I would suggest you look elsewhere. This shop is very high end so only visit if you are looking to pay a few thousand British pounds for a reasonably sized Buddha. Lovely shop but only visit if you are looking for expensive, exclusive homeware.",3.0 of 5 bubbles,"Written February 17, 2016"
327,Buddha_Gallery,wish come back again to this place to see amazing Buddhist gallery. the location very strategies from the center of tourism in Bali. i will come here again in near future.,5.0 of 5 bubbles,"Written September 23, 2015"
328,Buddha_Gallery,"If you are looking for an attraction to visit on your trip, this can be on your list. Good infact very good. I used it to teach my daughter a bit.",5.0 of 5 bubbles,"Written August 21, 2015"
329,Buddha_Gallery,"Small yet lovely shop/gallery, wouldn't make a day out to go there, but if you are passing then it's worth popping in. Quite small but has some notable items worth looking at, most items are for sale and only has a small description on each",4.0 of 5 bubbles,"Written July 18, 2015"
330,Positive_Negative_Visual_Gallery,I was quite intrigued to find so many art galleries in a place like Bali. However on second thoughts I realised that with livelihood so cheap and affordable here I am sure slot of expats and foreigners have made this place a second home. And in doing so why do the artists need to stay behind which resulted in mushrooming of so many Art Galleries in the beach town of Bali. I stepped into 'Positive Negative Visual Gallery' as it was in Seminyak itself where I was staying and I loved the fact that this quaint gallery attracted so many visitors. There were plenty of paintings on display and the  host was mingling with all with elan. I was glad I visited this place. It is certainly one off the beaten track.,4.0 of 5 bubbles,"Written December 16, 2018"
331,Positive_Negative_Visual_Gallery,"I took my two daughters to this cooking class and we had a complete blast. The staff were all really happy as well as being great cooks, teachers and really nice people. Unexpectedly a delicious cocktail was served at 11ish by the pool. So civilized. After learning about unusual and interesting spices - and a few tricks of the trade and local cooking techniques - we all sat down to eat the tasty Indonesian feast that we all created. A friend gave me the heads up about Coco Villas, which has much smaller groups than other cooking schools  so it wasn’t at all uncomfortable. Even if you don’t enjoy cooking, this activity is great fun.",5.0 of 5 bubbles,"Written October 3, 2018"
332,Positive_Negative_Visual_Gallery,"love the original art and the affordable prints here, quirky, stylish and vibrant art across a range of styles. A fabulous collection of original artists is displayed in an intimate space at the entrance to Cocoon restaurant on Double Six Beach.",5.0 of 5 bubbles,"Written June 13, 2016"
333,Positive_Negative_Visual_Gallery,"I walked in here while waiting for the rain to stop on the beach. I noticed the name and remeber reading about it on the internet. It featured a local artist and okay as a walk through.  Depends on your art interest.  Interesting to see and read the sponsored artist, Geoff Todd. I would not have gone out of my way to find it or go see it. Seems like there are several small one romm art galleries in seminyak that I would walk trhu as part of my neighborhood exploring.",3.0 of 5 bubbles,"Written February 11, 2016"
334,Positive_Negative_Visual_Gallery,such a calm and a beautiful place visit.its was a wonderful time such a relaxing place.enjoyed it must visit.,5.0 of 5 bubbles,"Written January 27, 2016"
335,Positive_Negative_Visual_Gallery,The gallery is interesting and showcases the talents of local artistsThe location is great in cocoon as it is a local attraction in itselfQuality work available here well worth a tripCentral and easy to find,4.0 of 5 bubbles,"Written January 23, 2016"
336,Positive_Negative_Visual_Gallery,"nice looking galery, even the collection was so good and value is wrote to visit this place to add you art experience",5.0 of 5 bubbles,"Written August 6, 2015"
337,Positive_Negative_Visual_Gallery,"Positive Negative Visual Gallery (PNVG) is a boutique gallery that hosts contemporary art. It is staffed by passionate young artists who clearly enjoy what they display. Visit it soon in the back streets of Seminyak before it is built out by ongoing construction.Calling into PNVG will only take 30 minutes form your day, coupled with a coffee or tasty treat from one of the nearby  food outlets will justify it as an outing.",3.0 of 5 bubbles,"Written June 30, 2015"
338,Positive_Negative_Visual_Gallery,"Debbie curates and exhibits a bold and diverse collection of artists, From Australian, and Indonesian through to European and American  artists. A great eye for stunning art, All affordable and her story telling of the artists and their pieces all go Soo well over with the wine and cheese on offer, Well done Debbie, Thankyou for making mine my family and my clients feel in trustworthy and knowledgeable hands.  This Gallery is the  Bomb!",5.0 of 5 bubbles,"Written April 15, 2015"
339,Positive_Negative_Visual_Gallery,"are you freaking kidding me! in a tiny room, few painting. that was it ? this place is crap !@&~: how did this place get ranked #1 in seminyak in the 1st place???",4.0 of 5 bubbles,"Written January 7, 2015"
340,Positive_Negative_Visual_Gallery,"Has some nice art work, different, one off pieces you wont find duplicated everywhere, a nice feel to the gallery, and nice service from the lovely staff",5.0 of 5 bubbles,"Written December 1, 2014"
341,Positive_Negative_Visual_Gallery,a nice change to find a gallery where the owner is there to tell you the story behind the picture. I liked the intimacy of this space. We went on Wednesday when Debbie has wine and cheese from 5-7 and has one of her artists turn up so you can discuss his art. Afterwards we walked into the Main Street where there were several galleries among the trendy shops and bars and then you could see how much more inviting Positive and Negative was. We didn't buy this time but plan to buy from her web site after we get home and have more time to check out her on line catalogue.,5.0 of 5 bubbles,"Written November 28, 2014"
342,Positive_Negative_Visual_Gallery,The gallery space is quite small and the art was nothing special. It is also a bit out of the way tucked in one corner of Jalan Drupadi.,4.0 of 5 bubbles,"Written November 23, 2014"
343,Positive_Negative_Visual_Gallery,This charming little gallery exhibits contemporary art beautifully. Very tasteful and good value for original works.,5.0 of 5 bubbles,"Written November 20, 2014"
344,Positive_Negative_Visual_Gallery,"Boutiques are amazing, locals are so friendly.. Taxi's at yr fingertips and the weather is consistently hot!",5.0 of 5 bubbles,"Written November 17, 2014"
345,Positive_Negative_Visual_Gallery,"Mossies ouch no Food path ' the Staff very help full , love the Bali People, whatch out at the markets barder as much as you can you will get for the price you like.",5.0 of 5 bubbles,"Written October 26, 2014"
346,Positive_Negative_Visual_Gallery,"Although the gallery is small, the artwork is mixed, diverse and interesting. The host Debbie was lovely and informative. All of the other staff were pleasant. Definitely worth a visit.",5.0 of 5 bubbles,"Written October 25, 2014"
347,Positive_Negative_Visual_Gallery,"This was a small room with art by one artist. I walked like 30 minutes to find this gallery thinking it was more of a large gallery or museum. It wasn't. I shoudn't have been so foolish, there is nothing to do in Bali but go to the beach! The staff was extremely nice though and made the trip worthwhile.",3.0 of 5 bubbles,"Written October 14, 2014"
348,Positive_Negative_Visual_Gallery,"Wonderful would not stay anywhere else while in Bali.This is the 3rd time staying at Pulau Tenang Bali Villas. My daughter & i were in Bali for our 66th & 46th birthdays. A big thank you to the amazing staff that are like my extended family now. Thank you Billy, Eddie, Jack, Korman, Kutut & The security. Nothing was to much trouble, always done with a smile on there face.The villas are very spacious and clean. I will recommened these lovely villas to all my freinds. I cant wait to return in march.",4.0 of 5 bubbles,"Written September 16, 2014"
349,Positive_Negative_Visual_Gallery,The space is quite small but there are some lovely pieces. My boyfriend and I hadn't heard of Geoff Todd but the collection was interesting for a quick look around. There are also some Balinese artists displaying here and it was some of their work that caught my eye more!,5.0 of 5 bubbles,"Written August 23, 2014"
350,Positive_Negative_Visual_Gallery,Traveled a reasonable distance to get there and was underwhelmed with the experience. Not a gallery I think I will return to. Air con was a positive though!,2.0 of 5 bubbles,"Written July 31, 2014"
351,Positive_Negative_Visual_Gallery,"From the moment I entered the gallery I was made to feel welcome and relaxed.  A stylish & modern environment  with warm and friendly staff.  I was given the space I needed to appreciate the art, yet owner Debbie was close by to answer any of my questions on her current exhibiting artist.I’ve now returned to the gallery on a number of occasions and have been converted from a decorative art buyer to an original art collector!Thanks Debbie, Ngurah and Mimi..  and Geoff Todd you are amazing!",5.0 of 5 bubbles,"Written July 1, 2014"
352,Positive_Negative_Visual_Gallery,"It was somewhat serendipitous that I walked into this unassuming (from the street anyway) gallery whilst making my way from one end of Seminyak to the other.I'm glad I did because it was one of the highlights of my trip to Bali. The gallery itself is not big which means there aren't many pieces on display, but the use of the space available and the quality of the pieces makes the visit to the gallery worthwhile. The attendant was very helpful and provided a wealth of information about the artist as well as the art work. I expected to spend a couple of minutes in there but ended up staying for at least a good half hour. Will definitely head back again in future visits to Bali.",5.0 of 5 bubbles,"Written July 1, 2014"
353,Positive_Negative_Visual_Gallery,After seeing some art at Cocoon I did some investigation to find the Gallery and was very happy to find that it wasn't too far away. I called in and made an appointment to meet Debbie the owner the next day. I don't know a lot about Art but Debbie was only to happy to explain to us all about the Artists. She helped me pick my Picture and when it was ready we were able to go back and have a look before it was wrapped up to take home already framed. I would recommend anyone to call in have a look and talk to Debbie.,3.0 of 5 bubbles,"Written June 9, 2014"
354,Positive_Negative_Visual_Gallery,We were delighted to find this lovely Gallery in JL Drupadi on the other side of the road from the new Harris Hotel. There are lot's of beautiful pieces on display. Debbie A the owner made us very welcome and even provided Champagne and Cheese. We suggest you visit the Gallery on the way to one of the many fine Restaurants at the Oberoi.,5.0 of 5 bubbles,"Written May 2, 2014"
355,Positive_Negative_Visual_Gallery,"If you like looking at art, this may be the place for you. I found it to be small. Apparently there is an upstairs, but couldn't handle the girl following me around anymore to find out what it was like",5.0 of 5 bubbles,"Written April 30, 2014"
356,Positive_Negative_Visual_Gallery,A gallery with high quality art. Showcasing and exclusive exhibition by famous Australian Artist Geoff Todd. If you are an art collector or would like to start then this Gallery is worth a look. Owner Debbie Amelsvoort will help you to understand the story behind the Art which is very heart centred.,5.0 of 5 bubbles,"Written April 29, 2014"
357,Positive_Negative_Visual_Gallery,"Positive Negative offers a new side to Seminyak. Its a great space where the art on the walls is matched by the casual, sophisticated vibe in the room. A great way to start your Seminyak night out.",5.0 of 5 bubbles,"Written April 10, 2014"
358,Positive_Negative_Visual_Gallery,"Walk into Positive Negative, you will be pleasantly surprised. The unique gallery displays stunning pieces by renowned artist Geoff Todd. The gallery is calming and the team welcoming. Grab a glass of wine,  ponder and appreciate the the art. If you are unable to take a 'Todd' home they have stunning photo's of Bali life you can purchase as a keep sake. A must visit gallery, different from the rest.",5.0 of 5 bubbles,"Written March 31, 2014"
359,Positive_Negative_Visual_Gallery,"Tucked away on a back street of Seminyak I stumbled across Positive Negative Gallery. I can safely say its not like all the other art you come across in Bali. The gallery itself has a great modern industrial feel and the exhibition on at the time of my visit was amazing photography that captured precious moments and images of people and things from all around the island. I walked away with two pieces for home, the staff were so helpful & careful in preparing the art to take it back home to Australia with me.Definitely a place worth stopping at during your travels around beautiful Bali.",5.0 of 5 bubbles,"Written March 31, 2014"
