,location,content,rating,date
522,Satria_Coffee_Plantation,Went there with our driver as a suggestion and was a nice time for sure the guide was very informative and showed us how the coffee is grown and then the different types of beans then we went for coffee and tea tasting and was nice then the guide sold us some cat poo coffee to try and was quite surprised by the taste was not what I was expecting for sure was quite weak in taste The guide also rolled up some local tobacco for us to try was different to say the least Then into the shop and we bought some tea that I haven’t tried yet but after reading the reviews appears to be a scam but still a nice reminder of our visit there,4.0 of 5 bubbles,"Written August 16, 2019"
523,Satria_Coffee_Plantation,"WOW what a place! they start you off with a tour of the plants they use for various coffees and teas, even flavoring plants like cacao and vanilla. This is not where they grow their products, they have a plantation far away somewhere but the plants that are present are only there for the tour. After that the tour guide sits you down at a picnic table and brings a medley of teas and coffee, all of this is completely FREE! Trying the Luwak coffee will cost you a whopping 50,000RP (3.5USD). I didn't find it to be special, just a nifty novelty that you might as well try since you are there and it could cost up to $100 a cup in the US. The tour guides are extremely friendly, and do not push you to buy anything, so one could technically go in and out without spening a dime. BUT, once you try the drinks, youll want to buy something, out favorite was the mangosteen tea, and the ginseng coffee (Ginseng is a root that is good for stamina, esp for men, so their phrase for that was ""Papa Drink, Mama happy"") i didn't give 5 stars however because their products are not cheap! you could get whatever they are selling from a supermarket or street market, but i didn't have the chance to compare quality of drinks.The location itself was very clean and peaceful, beautiful views of rice fields and forest. Breathtaking!Definitely would recommend!",4.0 of 5 bubbles,"Written August 15, 2019"
524,Semar_Kuning_Artist_Cooperative,"I expected a representation of the most important Balinese art trends. After visiting Arma Museum, I had high hopes. To my disappointment, the paintings are ""tourist"" oriented, fast made copies, often representing the same themes, colors, etc. To be honest, the same types can be found back home sold to tourist. The hosts were not pleasant either. Luckily, I decided to walk there from Ubud since I had a lot of free time and stumbled on the way back upon a house of a local artist that is located on the road when leaving Ubud - wow - that was amazing in comparison. A genuine Balinese artist's home of I Gusti Putu Sana. Not only I had a chance to walk around his family home, got invited for coffee and could experience the genuine Balinese art. This was a true gem.  Forget this cooperative, I bet there are more hidden gems like that around.",1.0 of 5 bubbles,"Written May 16, 2020"
525,Semar_Kuning_Artist_Cooperative,"We usually take years to find paintings that we both like and suit what we are looking for. However here we were spoilt for choice. There was such a range of styles to choose from and so many galleries, that we found many that we both liked. So, rather than having difficulty choosing a painting, our decision was solely determined by the size of the painting. Thoroughly recommended.",5.0 of 5 bubbles,"Written March 17, 2020"
526,Semar_Kuning_Artist_Cooperative,"Surrounded by vibrant, colorful and detailed paintings of all kinds, this artists cooperative will not disappoint. It is brimming with pieces that reflect life in Bali; many layered scenes of life, respect for culture and the natural world. There are paintings of every size and for every budget. Magnificent.",5.0 of 5 bubbles,"Written March 12, 2020"
527,Semar_Kuning_Artist_Cooperative,"We recently bought 2 paintings from here. We originally saw one painting at a gallery in downtown Ubud, then decided to pop into this place to compare what we wanted. Thank god we did, the downtown gallery was charging nearly double for the same artist's (different but similar) painting. The funds from your purchase here go to the collective of over 150 artists, we got 2 really special pieces of art instead of one since the variety and selection was so vast, for less than the price of the 1 we found downtown, what's not to love about that?! They made it easy to transport back to Canada, the whole transaction was smooth and everyone walked away happy. I'd highly recommend Semar Kuning even just for a visit, but if you're looking for some special art to take home this place is absolutely worth a visit.",5.0 of 5 bubbles,"Written January 31, 2020"
528,Semar_Kuning_Artist_Cooperative,"We visited one morning after breakfast and feasted our eyes on the wide range of artists portrayals of balinese life and culture for more than an hour. My favourite are the ""where's wally"" type of paintings by Soki with a multitude of cartoon like characters engaged in different aspects of Balinese life. One of the artist from the collective will accompany you during the tour of the compound but he is not pushy in sales and is around to guide you and answer your queries.",5.0 of 5 bubbles,"Written December 8, 2019"
529,Semar_Kuning_Artist_Cooperative,The place to see the work of arts by the locals. Such mesmerizing work of arts been exhibit here for us,4.0 of 5 bubbles,"Written December 2, 2019"
530,Semar_Kuning_Artist_Cooperative,we bought a lovely painting here. they wrapped made a custom travel tube out of pvc pipe. safely transported back to USA.,5.0 of 5 bubbles,"Written December 1, 2019"
531,Semar_Kuning_Artist_Cooperative,Great artworks and very helpful guide. Wonderful building and surrounds.You will get lost in the ambiance. Will definitely be back.,5.0 of 5 bubbles,"Written October 30, 2019"
532,Semar_Kuning_Artist_Cooperative,"We went here at the recommendation of our driver who was taking us to Tegallalang Rice Terrace.  I've heard that drivers do this to get a cut of any of the money spent by the tourists, but I don't care even if that is true.  This was such a marked difference between some of the other ""art"" galleries we saw in Ubud.  There is a huge variety, and sure some of the pieces aren't great, but there is a lot of higher quality local art here.  A salesman followed us around the whole time, but he was friendly and helpful, and not overly pushy so we did not mind.  We ended up getting two pieces of art, and were able to get a discount as a result, but my only regret is that we probably could have bargained a little more even.  Definitely worth a stop if you are looking for some decent, unique art from your trip to Bali.",5.0 of 5 bubbles,"Written October 24, 2019"
533,Semar_Kuning_Artist_Cooperative,"A huge range of canvas art available for purchase in the gallery. Many different artists display here, and the complex is quite a beautiful building too. Toilets available, but basic squat style.",4.0 of 5 bubbles,"Written September 26, 2019"
534,Semar_Kuning_Artist_Cooperative,"Amazing gallery with lots of art of all sizes, local artists with different styles. Clean and spacious!",5.0 of 5 bubbles,"Written September 19, 2019"
535,Semar_Kuning_Artist_Cooperative,"Little pieces start at 500k Rp, but you can bargain. We ended up with one at 250k Rp. There are many art pieces, depending on your art taste. There might be a piece or pieces for you.",3.0 of 5 bubbles,"Written September 6, 2019"
536,Semar_Kuning_Artist_Cooperative,"We went to two galleries, and Semar Kuning was by far the best. There are several galleries around that operate in the same way: you are greeted by one of the resident artists, you are shown some of the traditional techniques, and then your guide walks you through the many rooms of the gallery.There is a mix of contemporary and traditional subjects, with many of the subjects / styles repeated in different sizes or slightly different views. If you are looking for a truly unique piece of fine art, these galleries are probably not quite right. But if you are looking for something mid-ranged, it’s perfect.The gallery is well set up to provide you with the canvas rolled into a tube, so transportation home is not an issue.Don’t forget to negotiate on the price if you see something you like!",4.0 of 5 bubbles,"Written August 23, 2019"
537,Semar_Kuning_Artist_Cooperative,"There is a wide range of artworks available at this place. Don't expect any mind blowing contemporary art pieces. If you are looking for a Keliki painting or some traditionally beautiful scenes for decoration or souvenir I would definitely recommend this place. There are some unique gems among typical scenery and still lifes. 60% of sales go to the artist, and 40% to the collective. Some of the modern styles are a bit questionable but it all depends on your taste! Bought a beautiful still life painting at a very reasonable price.",4.0 of 5 bubbles,"Written August 20, 2019"
538,Semar_Kuning_Artist_Cooperative,"We bought a beautiful painting of a local artist, and our host gave us a lovely tour of this great gallery!",5.0 of 5 bubbles,"Written August 3, 2019"
539,Semar_Kuning_Artist_Cooperative,Our driver recommended this place when we said that we were interested in buying paintings. He said this is a cooperative where all the artists participate and are involved in its running and that the art was of good quality. There was no pushy sales involved with someone accompanying you around the different rooms where there were many different types of art work to suit all tastes. Be prepared to negotiate once you are offered a price.,5.0 of 5 bubbles,"Written August 2, 2019"
540,Semar_Kuning_Artist_Cooperative,"There are many rooms within this gallery, with paintings of all types and sizes available. We did purchase one small painting. It is important to negotiate if you want to buy any art here, as the initial prices offered were not at all reasonable and I found I had to be prepared to walk away in order to get a fair price. What I did not like about this gallery is that a sales person approaches you before you enter the gallery and continuously follows you around. I found this made me slightly uncomfortable and I would have preferred to look around unaccompanied by the sales person. I also found out that drivers get paid commission if they take you to this gallery, so even though I asked my driver to take me here, rather than it being his suggestion he will have been paid a percentage of what I paid for the painting, which is why he took such interest in how much I paid for the painting I suspect. This is kept very quiet, but be aware of this when you are negotiating for any paintings.",3.0 of 5 bubbles,"Written July 17, 2019"
541,Semar_Kuning_Artist_Cooperative,"We spent quite a few hours looking for the 'right piece' of art for a blank wall in our home. We tried paintings and woodwork at the usual spots like Ubud market, Sukhavati market, Tegallalang market, South Ubud, but nothing quite hit the spot in terms of quality and/or price. In fact, most of the paintings in the markets were just mass produced and lacked the uniqueness that we were after.After miles of driving looking for wall art that day, our driver suggested a visit to the Semar Kuning Artist Cooperative - and am I glad he did! The place is essentially a coming together of various local artists - the 'salesmen' are also artists themselves. Prior to entering, we were requested to not photograph any of the paintings.The cooperative is housed in an old mansion with room after room of paintings hung from the walls. The paintings comes in a variety of sizes and styles/themes - landscapes, traditional, dancers, modern art, etc. I do not claim to be an expert on the subject, but IMHO most of the paintings appeared to be significantly better than all that we had seen in the markets - both in terms of quality as well as uniqueness.Walking through the various rooms, the wife and I zeroed in on (love at first sight, actually) one of the paintings by a local painter of some repute. The initial ask was for IDR 8 million - it took the salesman a couple phone calls to get the artist to agree to our final quote of IDR 2.4 million. The billing process was then quite swift, and the packaging thorough. I was worried about whether the PVC pipe would hold its shape for the duration of our travel, but am glad to say that it did.We are now back in India, and cannot wait to get this up on the wall!",5.0 of 5 bubbles,"Written July 16, 2019"
542,Semar_Kuning_Artist_Cooperative,"A huge selection of paintings by local artists mainly done in acrylics. We visited for a short time as part of a day tour of the Ubud Area. Sadly did not buy any paintings, the ones we liked were out of our budget.",5.0 of 5 bubbles,"Written July 7, 2019"
543,Semar_Kuning_Artist_Cooperative,"Our villa host brought us to this magical place. Room after room of amazing art, large to small, traditional to modern, abstract, impressionistic, you will find something that you love. Staff will accompany you, discreetly taking note of your likes. A final price will be reduced, particularly if you are purchasing more than one piece. Note that photos are not permitted, except of your final purchases. I’m so thankful for being shown this place, a real treasure.",5.0 of 5 bubbles,"Written July 5, 2019"
544,Semar_Kuning_Artist_Cooperative,The most phenomenal art experience I’ve had the pleasure of enjoying. A must visit when traveling in Bali.,5.0 of 5 bubbles,"Written July 4, 2019"
545,Semar_Kuning_Artist_Cooperative,"We found this shop with the help of our hotel. While I am sure they probably have a connection with all the hotel concierges, it was nice to look through the art at our own pace (although being followed by a sales person). There are a wide range of styles, all price points and all sizes. If you tell them what you are looking for, they can direct you to the best pieces of that style. They have works by students and masters. You can see the difference in the quality and better understand the pricing. Expect to negotiate if you decide to buy something.",5.0 of 5 bubbles,"Written July 3, 2019"
546,Semar_Kuning_Artist_Cooperative,"The art 🖼 is incredible, as usual Balinese custom, everyone is extremely welcoming and professional. The artist took the time to walk me through the entire gallery until I found the piece that spoke to me. A reminder of the sense of peace I feel in Bali in the concrete jungle of New York.",5.0 of 5 bubbles,"Written June 25, 2019"
547,Semar_Kuning_Artist_Cooperative,"Artists market with huge range of styles from traditional to modern. We choose a contemporary piece with an incredible amount of detail. Price was negotiated, there was no pressure to purchase. Packaged excellently for travel. Highly recommended, and special thanks to Roy for his explanations and patience.",5.0 of 5 bubbles,"Written June 21, 2019"
548,Semar_Kuning_Artist_Cooperative,This was an amazing place for art. All kinds of art. Not just Asian art but impressionis and  contemporary  art. I did indeed buy some art they rolled it up and boxed for flight.,4.0 of 5 bubbles,"Written June 6, 2019"
549,Semar_Kuning_Artist_Cooperative,The quality of the painters was more for tourists. The gallery was more for tourists who enjoy mainstream art. Lacked authenticity.,3.0 of 5 bubbles,"Written June 5, 2019"
550,Semar_Kuning_Artist_Cooperative,"We had hired a guide and driver for the day and arranged several specific stops in and around Ubud.  Along the way, our guide asked if we wanted to stop at an artists cooperative and being ones who love to buy art when we travel, that was a no-brainer!  While I think our guide thought we'd be there for 30-45 minutes, we ended up there for three+ hours and bringing home four pieces!  They have a phenomenal array of styles and subject matters and even some of the less expensive pieces make EXCELLENT souvenirs!  On two of them, even the frames were beautiful reminders of our trip to Bali!  So VERY glad we stopped (and be sure to walk around their beautiful shrine behind the gallery!).",5.0 of 5 bubbles,"Written May 16, 2019"
551,Semar_Kuning_Artist_Cooperative,Beautiful art and price is very negotiable. Ask for Katutroy and he will take care of you. The variety is endless for all art lovers.,5.0 of 5 bubbles,"Written May 15, 2019"
552,Semar_Kuning_Artist_Cooperative,"Semar Kuning Artist Cooperative has a fabulous collection of local artwork for sale . The gallery is housed in a traditional Balinese pavilion showcasing landscape , abstract, traditional Balinese local paintings. Its a must do if looking for artwork to take home.",5.0 of 5 bubbles,"Written April 25, 2019"
553,Semar_Kuning_Artist_Cooperative,"This visit was part of day trip to the various attractions of Ubod. The co-operative has paintings by the hundred. Many local styles and many influenced by Western art. As you walk from room to room the influences can easily be seen, Monet, Picasso, Rousseau. I purchased a oil painting by an ubod master called Evan. There were many images of the Buddha, but this monochromatic one had a serenity and quality. the price was good. It was well wrapped and packed. (A good job as Qatar Airlines did not load it and had to send it another flight and deliver it) I will get it framed and design a room with it as the focal point. Very happy",5.0 of 5 bubbles,"Written April 24, 2019"
554,Semar_Kuning_Artist_Cooperative,"Do yourself a favour and go here first before you try buying art from street shops and wannabe galleries. You will realise the difference instantly. Quality, presentation, collection of art work is so different than what you see on streets.It also helps that it's all artists under 1 roof  are selling  their art together giving the cooperative a commission on sales. I could have easily spent a full day here talking to the various attendants on the art they were selling and discussing artist's lives. Must be approx 700 paintings on display.So the attendants are basically Balinese artists themselves who make traditional art. They sell their art along with an assortment of all genres. You see them making art in front and also in end halls where more traditional artwork is hung. Multiple halls featuring various genres will just transport you into Bali and its culture and artist's perspective of how they see Bali.I ended up buying quite a few pieces.Frames are free so if you want, they will dismantle and give them to you. They also meticulously pack everything. How is the art priced: They know you are a serious buyer if you are coming here so the prices are for sure higher than street galleries but do the Bali bargaining thing and start from one third the price. Having said that, I didn't see any of the artwork I bought in any of the galleries. We tried almost 7-8 shops in Ubud and Seminyak but didn't find a single piece that was similar.They tell you they will call the artist directly and if the price is ok, the art work is yours.Our guy did call multiple artists in front of me and we negotiated on a final price before paying.Loved the experience and loved everything I bought.So sweet of them to serve my mother some balinese coffee when we requested.",5.0 of 5 bubbles,"Written April 23, 2019"
555,Semar_Kuning_Artist_Cooperative,I love to see local artist paintings. You can see how long it took to perfect their styles in their paintings. There were a few paintings that we were interested in buying but weren't the right size for us. Definitely recommend.,5.0 of 5 bubbles,"Written April 6, 2019"
556,Semar_Kuning_Artist_Cooperative,"I really like some of the art here and would probably have bought something had I not gotten so hot (I'm such a wimp for hot and humid).  Aircon would have ensured a sell, and I especially liked the Young Artist genre.  If you can handle the heat better than I it is 5 Stars!",4.0 of 5 bubbles,"Written March 2, 2019"
557,Semar_Kuning_Artist_Cooperative,"Located in the Ubud area is this large art gallery that includes two separate building displaying traditional Balinese and modern/abstract paintings.  Our tour operator described this artist cooperative as the best painting sales location  in Bali.  We were impressed by the variety of the work some of which was by new artists trying to establish themselves and some of it by masters who have established themselves as the standard to which the new artists are trying to match.  Prior to entering the main building a few artists were demonstrating their artistic skills.  The shop/studio has a wide range of styles and small to very large paintings.  We wanted to purchase one very nice painting but the very large size (6x4 feet) would not fit on any wall in our house--the price was very reasonable for the piece which was then purchased by one of our friends.  The shop does not ship but they do remove the painting from its frame, carefully roll it up with tissue paper and insert it into a stiff cardboard tube enclosed at both ends.  They take all credit cards.  The display frames are not included in the quoted price.  Discounts are available if you ask--20% is typical but it also depends on how long they have had the piece.  The individual artist actually sets the price but I suspect that a comparable piece would cost 90% more in the states in an art studio.  Certificates of authenticity are given for the master artist paintings.  If you are a collector this is the place to visit for a Balinese painting.  It is also interesting to wander into a back room where you can watch the staff prepare a painting that has been sold.",5.0 of 5 bubbles,"Written February 18, 2019"
558,Semar_Kuning_Artist_Cooperative,The craftsmanship of these amazing artists is inspiring! They should get much more world recognition for their amazing skills!,5.0 of 5 bubbles,"Written February 4, 2019"
559,Semar_Kuning_Artist_Cooperative,Very helpful staff helped me find the right pieces I was looking for. Thanks again for working and being patient with us until we found the right pieces we were looking for.,5.0 of 5 bubbles,"Written January 30, 2019"
560,Semar_Kuning_Artist_Cooperative,"it was an amazing experience, a warm welcome and friendly atemosphere blends in all of the paintings displayed. a big shoutout to Ketut Roy for helping to find the best and suitable painting for us.. a must place to visit when in bali for all ya painting painting lover!",5.0 of 5 bubbles,"Written January 2, 2019"
561,Semar_Kuning_Artist_Cooperative,"Well worth the hour and a half we spent here discovering great artists, nice people and think about beautiful stories behind the paintings. Thank you for the great time",5.0 of 5 bubbles,"Written December 29, 2018"
562,Semar_Kuning_Artist_Cooperative,Great place to see local artReasonable prices and large selectionAsk for price before discounting buyingIt’s a cooperative so prices are negotiable Very happy with purchase,5.0 of 5 bubbles,"Written December 26, 2018"
563,Semar_Kuning_Artist_Cooperative,"I wanted traditional Balinese paintings, and I found them here. You'll see many styles, so you are sure to find something you like. The artists are working on their sketches as you enter the gallery. The prices are negotiable, and I am happy with the price I paid. The work is framed and I decided to keep it that way. Originally, I thought to remove the canvas but the seller  wrapped them for easy transportation. Come to be inspired,  pick up some original work, and support the artists. I can't wait to hang up the pieces in my home!",5.0 of 5 bubbles,"Written November 3, 2018"
564,Semar_Kuning_Artist_Cooperative,Amazing collection of works by local artists. Great service and very flexible in terms of delivery arrangements.,5.0 of 5 bubbles,"Written November 3, 2018"
565,Semar_Kuning_Artist_Cooperative,This place has thousands of painting by local artists in manny styles. Lots to see and everyone is. Rey friendly and can barter on te prices. Definitely worth a stop off,5.0 of 5 bubbles,"Written October 16, 2018"
566,Semar_Kuning_Artist_Cooperative,Seeing is believing! This place has so many paintings almost 95% all originals! This is a must for any art lover,5.0 of 5 bubbles,"Written September 26, 2018"
