,location,content,rating,date
435,Surf_Turf_Nusa_Dua,"We stayed at the Melia hotel at Nusa Dua and found this little 'beach club' gem a couple of minutes from our hotel and right across the road from Bali Collection gate C. We ended up  going there most days for an hour or two to break up the day/ have lunch / dinner  etc as my two sons 11 and 13 couldn't get enough of the simulated surf rider and water slides. Really good value at about $7/ hour for surfing or $15 for an all day slide package including 2hours of surfing. Many times we went there, the boys had the slides/surf rider to themselves or there was only a couple of other kids which was magic and a great way for them to burn off energy as Nusa Dua can be pretty quiet. The food was about a third of the price of our hotel and the menu was good, standard fare - burgers, sate chicken, pizza, noodles, etc. The pool deck had lots of sun lounges and overlooked the ocean. Happy hour was from 4-7pm. The staff were all so amazingly friendly and welcoming. Would definitely recommend this place to others and would return again one day.",5.0 of 5 bubbles,"Written January 20, 2017"
436,Surf_Turf_Nusa_Dua,"this place offer an adventure for those who stay in Nusa Dua area. Spending the day with learning how to surf, rent a bicycle to go around or just enjoy a cup of drink at its cafe shop. you will call your day the funnest day in nusa dua",4.0 of 5 bubbles,"Written January 16, 2017"
437,Surf_Turf_Nusa_Dua,"Just a short walk from our hotel we went here kids absolutely loved it, was great way to spend two hours they also have a pool you can swim in the young coconuts were yummy had a few question marks about there safety standards but overall very good and would go back",4.0 of 5 bubbles,"Written January 11, 2017"
438,Surf_Turf_Nusa_Dua,"We stumbled on Surf & Turf by accident while looking for somewhere to eat in Bali collection.  It's a small beach club (not a hotel) with 3 water slides and a flowRider.  Our 12 year old son LOVED it.  It's small but suited us just fine.  Staff are friendly and welcoming, especially Gede who welcomed us from the beach front.  Nusa Dua is a very quiet area so our son was getting very bored until we found this place.",5.0 of 5 bubbles,"Written December 30, 2016"
439,Surf_Turf_Nusa_Dua,"We loved this place as an alternative to our resort for the afternoon. It cost 70 000rph to enter and you can stay as long as you like(kids under 5 are free). There are only 3 slides, a pool and baby pool but that was enough to entertain my 6 and 4 year olds. Plenty of deck space with pool lounges for the grown ups to kick back on, cheap cocktails and beer, and the food was cheap compared to resort food. The staff were super friendly and helpful. It's right next door to Pirate Bay which the kids love too, and the calm, clean beach is in front of the establishment. It kept everyone entertained for the arvo! We'll definitely go back for an afternoon on our next visit to Bali.",5.0 of 5 bubbles,"Written December 27, 2016"
440,Surf_Turf_Nusa_Dua,We were looking for a more family friendly beach club in Nusa Dua where the beach waters were less rough than the Seminyak/Kuta area where we were staying.    Surf & Turf came up as a choice.   The beach was much calmer and more clean than Seminyak/Kuta.  The only downside was that the beach was much more rocky.Surf & Turf itself though was quite disappointing.   The pictures made it look much more majestic in terms water slides and kids activities.  The facilities were quiet dilapidated and run down.  The grounds were poorly maintained.   The food quality was questionable and the English of the staff was below average.  It was one of our worst experiences in Bali.  We planned to stay there for the whole day and could only handle 2 hours.,1.0 of 5 bubbles,"Written December 24, 2016"
441,Surf_Turf_Nusa_Dua,"Cost RP200,000 per child for all the rides (limited to 2 hrs on the wave rider but unlimited time on the others). Parents are free entry, unless you want to ride as well. Our boys (11 & 9) love mastering the wave rider which was fun and safe. Some tips: no external food or drink allowed in and bring lots of sun protection.",5.0 of 5 bubbles,"Written December 24, 2016"
442,Surf_Turf_Nusa_Dua,"Went yesterday for a half day. The kids had a blast. It is not 5 star but all they want are slides, wave rider, no lines and non stop fun.Staff were so helpful and always had a smile on their faces.Had a great lunch too.",4.0 of 5 bubbles,"Written December 23, 2016"
443,Surf_Turf_Nusa_Dua,This place is quite small with not many rides. You can get a beer and food there. The best thing about it is the surf ride . Adults and little kids can both ride it. For$13 Australian is it really cheap fun. The bali guys that run it a great fun too.,5.0 of 5 bubbles,"Written December 8, 2016"
444,Surf_Turf_Nusa_Dua,Enjoying time with friends.  The food was so yummy. Recommended chicken BBQ. & chicken incilada  😃😃😃 I thought .,5.0 of 5 bubbles,"Written December 5, 2016"
445,Surf_Turf_Nusa_Dua,"What a lovely time and we had so much fun with friends , foods are nice we'll be back again for sure ❤️😀❤️ recommended to come here for you all",5.0 of 5 bubbles,"Written December 5, 2016"
446,Surf_Turf_Nusa_Dua,"Today is the second time I and my husband spent an afternoon in here. Food is lovely, reasonably priced (we ordered pizza (65k), two soups (45k for one), fish and chips (65k)). Food cooked perfectly, not oily at all. Portions are average sizes. Do not pay any attention to comments about injuries -as almost everywhere, you enter swim facilities at your own risk, and if you have kids - you must watch them at all times ( this is just a common sense). Entry is free, if you need, you can hire a towel (10k), or a locker (10k). Overall, it's a good ""4"" star place.",4.0 of 5 bubbles,"Written November 9, 2016"
447,Pulau_Nusa_Dharma,"I am Yoga Efendi, a guide and a traveler from Yogyakarta - Indonesia. This Rock Island has pretty big space and has a small Balinese Shrine in the middle. The view surrounding is beautiful, especially when you love photography. Entering the Shrine is forbidden without proper dress.",5.0 of 5 bubbles,"Written January 30, 2020"
448,Pulau_Nusa_Dharma,"I never know there is a free hidden gem to see at Nusa Dua.. This is one of them, you can see the blue waves sea with close distance. I recommend you to go here.",5.0 of 5 bubbles,"Written September 5, 2019"
449,Samabe_Bali_Pool_Beach_Club,"This is our second visit here as a family and, once again it did not disapoint. We had a superb high tea down at the beach and the children really enjoyed the bubble party. Well done Samabae, thanks for a perfect stay once again. We will be back.",5.0 of 5 bubbles,"Written April 15, 2019"
450,Samabe_Bali_Pool_Beach_Club,"We loved our weekend there. Quite, beautiful, clean. The villa was very homy and airy, very well equipped. They managed to take into account every little little detail. Just loved it. There were some service issues, but it was that disturbing if you know what i mean. The manager of the resort is really there all the time, which gives you a sense of presence. U feel they take care about you. We haven't managed to try the food in the cave resto as it was fully booked. But the breakfast was quite nice with average coffee though, which is not good enough for coffee lover, but normal for the big hotel like this. Views are rare, great chilly breeze....loved it and will come back for sure.",5.0 of 5 bubbles,"Written May 11, 2018"
451,Samabe_Bali_Pool_Beach_Club,What a great resort with perfect staff and superb rooms. The food also never disappointed and the service was great.,5.0 of 5 bubbles,"Written December 26, 2017"
452,Samabe_Bali_Pool_Beach_Club,"Though the Hotel offers great views of the Indian Ocean with great landscaping, but its a BIG disappointment in Guest services. We booked Ocean View Private Pool Suite. Food is very average and you can explore many other options available in the area. We asked Room Service to warm up our 3 items of pre-packed food. After 10 mins, she calls and tells us that there will be a charge of $6 for warming the food. Though we felt strange but agreed. However, when the food comes we found they charged $6 for each item! Not expected from a 5 Star Resort which claims excellent Hospitality. I had to call the Butler Service  to get it waived. But it was surely a disappointment. On the day of the check-out, we were bombarded with phone calls right from 12 pm to vacate the room. We were on laid back holiday and were at the Beach so it took us just a while longer. We had also intimated the The Front Office previous night that we will check out around 1-1.30 pm. In spite of this, Front office also threatened my wife at least 3 times that they will charge for additional night if we do not check out immediately. They even sent a buggie to our villa without even telling us to take our luggage. Big Harassment! We literally squeeze in everything into our bags and rush. This Hotel certainly needs to learn from its Neighbour Mulia what exemplary Hospitality is!",3.0 of 5 bubbles,"Written May 19, 2017"
453,Samabe_Bali_Pool_Beach_Club,"We have discovered PARADISE here at Samabe.  We are a family of 4 and have come to Samabe on a Scoopon Deal.  If you are considering Samabe for your next luxury holiday BOOK IT NOW!!!We were greeted at the airport with a warm smile and transported in a luxury van to Samabe late at night.  When we arrived we were promptly welcomed by the lovely staff, layed and offered a nice cold coconut drink and peppermint refreshment towel.  Check in was smooth, fast and informative then we were whisked away in a buggy to our lovely room.We were so pleasantly surprised to wake to the stunning ocean view from our room. The room itself is equipped with everything we could need and more and is very spacious, clean and comfortable. There is a lounge and dining room, two bathrooms and a huge bedroom with two queen beds and a single bed.The beds are very comfortable, the bath tub is huge and the shower is devine. There are two TV's in separate rooms which is great when you have kids. There are lots of channels and YES they do have Setanta which plays all of the rugby league games live! The rooms are equipped with all amenities and there is even a pillow menu.The resort itself is gorgeous. It is immaculately clean and has all of the necessary facilities. The infinity pool overlooks the ocean and has a bar. The gym is 24 hours which is handy. There are 2 restaurants. The breakfast is spot on offering a buffet and a la carte menu with plenty of variety for everyone whether you want to pig out, eat healthy or require gluten free. The other restaurant offers a great selection of western, asian and seafood. Everything we've ordered has been exceptional.There is a kids club from 9:00am to 5:00pm everyday which offers various activities for the children to enjoy. This gives you the opportunity to take advantage of the heavenly spa. The massages we got combined with the ambience and caring service at the spa have been a highlight for me.The resort has a private beach down 170 safe steps from the pool. The staff work tirelessly to keep the beach pristine and there are several sunbeds and beanbags on offer with lots of cool shady spots to relax in. They offer kayaks, paddle boards, windsurfers, snorkelling gear and a catamaran. There is also a small bar for refreshments.  But the highlight is the two caves which are used for special romantic meals and afternoon tea – which was such a special experience for our family.The service at Samabe is second to none. From the moment we arrived we have been greeted, pampered and looked after by every single staff member.  They all go out of their way to ensure that every one of our needs are met. I would like to thank each and every one of the staff for making our entire stay so special and memorable. The resort is stunning but you are the ones that make Samabe our new favourite slice of heaven on earth.We always like to explore and try new things so we have never stayed at the same place twice but Samabe you have captured our hearts with your warmth and serenity so we will be back. Thank you!",5.0 of 5 bubbles,"Written April 7, 2017"
454,Samabe_Bali_Pool_Beach_Club,"Beautiful place, amazing food and well trained staff..One of the nicest afternoon teas at Nusa Dua. The service was perfection and the food was just so amazing, plenty of it and beautiful presented with bird's cage. Beautiful natural cave and clear beach. This was a truly magical experience, we could talk and relax while enjoying the cave and beach. Hope to return again when it's summer.",5.0 of 5 bubbles,"Written January 11, 2017"
455,Samabe_Bali_Pool_Beach_Club,"We visited the Samabe beach club with our kids along with another family we met in Bali. We noticed there have been a lot of new beach clubs built in Bali since our last visit and it seems to be the new trendy thing so we decided to visit Samabe's beach club, having loved our stay at Samabe as guests in the past. So, during our last full day in bali we decided to treat ourselves to a day at their beach club.It was around 350,000 rupiah per person (around $25), which is pretty affordable compared to some other beach clubs in the more crowded areas of Bali like Potato Head for example. A part of the fee is actually credit that we got to use to buy food and drinks. We could have also used it for the spa, but we were hungry! The fee also included the use of the beach or hotel pool, as well as kayaks, the gym and the kids club. I found it was great value for money, and since it only recently opened this beach club should be becoming more popular soon, keep your eye out!",5.0 of 5 bubbles,"Written January 4, 2017"
456,The_Bay_Bali,A day trip to this beautiful place is a must. Lots of vast garden areas to just sit and relax. Beautiful statues add to the ambiance of the place. Another entrance takes you to a small beach area. Good enough for photos only. Lots of small jagged rocks reminds of the same rock in a place called hell in the Cayman Islands. Art gallery and  tourist shops as well as restaurants. Great shopping at Sogo,5.0 of 5 bubbles,"Written February 13, 2020"
457,The_Bay_Bali,Although The Bay is still operating - couple of restaurants and bars - surf and turf has gone. It says they are creating something new but it didn’t look like much was happening.,1.0 of 5 bubbles,"Written January 25, 2020"
458,The_Bay_Bali,This place looks nothing like the reviews and photographs as it was probably in its peak in the 2017 period and now appears in declineAlthough being far over rated we found the walk between the two headlands and in front of the fantastic hotels to be enjoyable and the beach appeared very clean and user friendly. Take swim wear and towels etcThere are a number of free shuttles operating from local resorts some businesses to and from  We went from our local villas where we were staying and we are dropped off at the entrance to the beach walk ..fine for wheel chairs etcYou can go left or right and there are small headlands on either side  Which appear to be very interesting space but due to the extreme heat at noon  we only went to the left and in front of some Beautiful hotel resorts Which looked fantastic Can’t remember their names but if you look them up on a map you can’t go wrong with any of them in the atmosphere would be fantastic here to stayThey all had restaurants where you can eat but we decided to try and find one in the public domain our taxi driver had recommended the dirty duck so we sought it out. Apparently it is very popular with Asian visitorsUnfortunately we found it most disappointing _ crispy skin duck was not what I thought it would be and looks more like leftovers from Hiroshima  The duck spring rolls were very Greasey we sat inside next to and are below fans as it was so hard and not in the area which does have a view of the beach unfortunately the indoor area reminds me of a Chinese industrial site similarly for our experience we forgot to take our Mosquito repellent and our legs and feet were attacked which is really not their fault ! just did not add to the experience and the kebab restaurant next door which has a large menu appears a better choice From what we saw this is certainly not a shopping centre in any shape or form but a nice little beach with a handful of restaurants if you wanted a change of scenery from your hotel surrounds yes I’m glad that we visited this Location but I can see no point in returning however the walk between and including the head lands on a cooler evening could be a romantic walk. Worth a visit if you’re bored and don’t want to leave Nusa Dua,4.0 of 5 bubbles,"Written January 23, 2020"
459,The_Bay_Bali,"very relaxing and chilling late in afternoon around 4 pm, not too hot weather is ok and we have a good time was playing water in the side of the beach",4.0 of 5 bubbles,"Written December 31, 2017"
460,The_Bay_Bali,Mainly the header describes the situation already. Beach area not maintained after the damages caused by the water. Prices even for an simple coffee totaly not acceptable. You will find a bunch of better locations around!,5.0 of 5 bubbles,"Written January 7, 2017"
461,The_Bay_Bali,"A great and spicy Tom Yum Yam soup kicked off a meal that in the end turned out to be a disappointment.  Very chewy beef satays and a rather small amount of peanut sauce was overall tasteless.  The chicken satays were better, but still hardly extraordinary.  The waitress then disappeared and we waited about a half an hour in the heat to pay the check.",5.0 of 5 bubbles,"Written October 4, 2016"
462,The_Bay_Bali,"this restaurant is good. nice food, nice view with bay bali. nice pool too. but very long serve food. we order steam boat, tempura etc but we are waiting too long then tempura we just take away. juice is very solid need water again to drink it. food on boat is very uniq but because too long some of our friends left without eat. plate is dirty. too many animals around our food.",3.0 of 5 bubbles,"Written August 27, 2016"
463,The_Bay_Bali,"The Bay at Nusa Dua will go down in history for me. ...I am very well travelled and this was one of the worst beach experiences....  toilets were disgusting, charge for nothing just a bucket as everything broken, extra charge for paper,  beach chairs 100,000 rph even though it was 3.45pm was nothing more than a rip off.  People from hotels lounging in luxury you could purchase drinks but not use the beach....what an absolute disgrace felt like a real second class citizen.",4.0 of 5 bubbles,"Written July 20, 2016"
464,The_Bay_Bali,"If you want to visit Nusa Dua and spend an afternoon on a clean, safe and quiet beach but are concerned about having to pay to visit a 5 star resort then The Bay is a great alternative.  Our driver  took us there late morning, lovely spot, great beach for swimming and just playing around in the water, our kids loved it.  There is a beachside walkway where you can wander along checking out a variety of restaurants and head out on the headland to check out the blowholes and a couple of large statues. It is a nice precinct and came as a pleasant surprise in an area renowned for exclusive luxury enclaves.  Highly recommended spot.",4.0 of 5 bubbles,"Written March 23, 2016"
465,The_Bay_Bali,"Nice bay, but maybe needs maintenance. Past month high waves repeatedly crashed the bay and messed up the shore; However, restaurants seem to be in good shape, look clean.",4.0 of 5 bubbles,"Written January 12, 2016"
466,The_Bay_Bali,Good choice and quality of food when you fancy a change of scenery from the resort hotels.Visited recently as a family of 4. Don't let the absence of people put you off from venturing in during happy hour for the cocktails and food.Great views onto the beach in the evening,4.0 of 5 bubbles,"Written August 10, 2015"
467,The_Bay_Bali,Is a group of very well organized beach clubs and restaurants. You can enjoy a relaxing day in the beach while having your drink/coffee or meal/dinner. Not to be missed. Have been to more than 3 different restaurants the most unique experience there is the Pirates club (or something like that) with tables on the trees or in a simulation of pirate ship.5 min walking distance is the Bali collection if you have missed shopping,5.0 of 5 bubbles,"Written June 24, 2015"
468,The_Bay_Bali,"The Bay is an entertainment complex in the Nusa Dua area consisting of beachfront restaurants, beach clubs, hotels and resorts. With so many varied waterfront offers/attractions in close proximity, the beach tends to get crowded so the area is not the best for seclusion. It's proximity to the Bali Collection shopping complex doesn't help either. Not many people bothering you to buy things, a nice positive.The ocean views offer the opportunity for great pictures of the scenery but up close the trash polluting the shore and the water is a very sad reality. Often you see locals making cleaning efforts (specially in front of the resorts) but this is simply a reactive effort that doesn't address the source of the problem. This issue must be properly addressed.The Bay is a place where I would come for a walk to enjoy the view and have a beachfront meal but would not stay in this area or come here simply to enjoy the beach.",3.0 of 5 bubbles,"Written May 21, 2015"
469,The_Bay_Bali,"We had to find this place a bit difficult due to its location at rather dark place area at night, but the atmosphere of one of the restaurant was good enough for having dinner",3.0 of 5 bubbles,"Written February 12, 2015"
470,The_Bay_Bali,"being there just 10 days before Christmas this year the expansion is ongoing.Looks very nice,but the construction is disturbing.Food selection is good and the tastes are divers.Hope that the construction will be over soon",3.0 of 5 bubbles,"Written December 13, 2014"
471,The_Bay_Bali,"I tried to call them 3 times to know if they were open for lunch. The first time they hung up, no reason why.. Second time, no answer. Last time (because I really wanted to go there), they didn't speak in English and wasn't able to let me speak with someone else... For a high standard restaurant, it is NOT the appropriated service.. Too bad because I really wanted to go there, regarding all the good reviews...",1.0 of 5 bubbles,"Written September 2, 2014"
472,The_Bay_Bali,"The Bay Bali is located inside the Nusa Dua complex. It has a collection of restaurants all with different themes. Close to Bali Collection shopping center, Bali Bay is right on the waterfront and the restaurants all have opn air seating spaces overlooking the water. Try Bebek Begil for a traditional meal or any of the other places. Makes for a good day out. Take a walk along the waterfront pathway - very pretty views to the ocean.",4.0 of 5 bubbles,"Written August 4, 2014"
473,The_Bay_Bali,"We had our lunch and dinner at the Opera and I have to agree with the other review here, the Thai food is one the tastiest in Bali.  The pool was big and clean plus the beach was very relaxing, clean and quiet (no beach peddler). And the price was reasonable. But like the other reviewer here, there were not many people when we came here and ""the staff"" were not that attentive, there was no one a the entrance, most of them ""chatting"" near the bar. And it need a little renovation.",4.0 of 5 bubbles,"Written July 20, 2014"
474,The_Bay_Bali,"Nice and clean local food. We wanted to try the local food and found this place in The Bay Bali. We stayed at Melia Bali and the food was expensive and didn't have much local food. So we explored around the area and found this place. It was very quiet and at first i was a bit scared to try for fear of having food poisoning. But went there twice and was ok. Recommend the beef rending, stay and the pot of Kopi susu poci. - lovely way to start and end the holiday!",4.0 of 5 bubbles,"Written May 23, 2014"
475,The_Bay_Bali,"Great thai food indeed at Opera. The curries are the best. Clean and large pool. The club is facing the ocean wth right access to the beach. This place is empty every time we go there but somehow we appreciate the great combination of good food, beach, swimming pool and comfy beach chairs (our daughter loves the pool). Only one staff polite and active , the rest was chatting and not attentive (perhpas because there was nobody to serve but us???). Needs renovation, a bit run down.",4.0 of 5 bubbles,"Written May 15, 2014"
476,The_Bay_Bali,Had lunch in the Indonesian part of this restaurant on the beach. Great view of the beach and surrounds and the food and traditional Indonesian drink were great. Only had the special of the day which only cost 135000RP! Would recommend this place to couples and families. No people trying to sell you stuff all the time. Beautiful gardens and surroundings.,5.0 of 5 bubbles,"Written February 5, 2014"
477,The_Bay_Bali,Beautiful holiday and magnificent staff special thanks to rusydi the marketing manager treat me like a king I will suggest this place to everybody perfect seafod and cocktail thanx to the barman as well,5.0 of 5 bubbles,"Written January 7, 2014"
478,The_Bay_Bali,"The tastiest Thai I have had in Bali. Authentic and flavoursome, great staff, view and Thai chef. Recommended - it won't disappoint!",5.0 of 5 bubbles,"Written September 26, 2013"
