,location,content,rating,date
0,Nusa_Dua_Beach,The beach was relaxing. We can't really enjoy the magnificent sunset like in Kuta beach or Uluwatu since we're on the east side of the island. However the experience was world class!,4.0 of 5 bubbles,"Written December 29, 2021"
1,Nusa_Dua_Beach,The beach is dirty sand bags piled up 2m slippery dangerous pay to get in to dirty beach people are not friendly think god gave them the.beach god gave the beach to all people god angry sent big waves washed away what was the beach boring place to stay dont go there cqrnt ride bikes carnt walk on foot path very rude security stay away feom nusa dua,1.0 of 5 bubbles,"Written November 3, 2021"
2,Nusa_Dua_Beach,"Great beach, easy to do social distancing. Many 5 stars hotel in the area. Perfect, quiet, and safe for family and kids.",5.0 of 5 bubbles,"Written May 29, 2021"
3,Nusa_Dua_Beach,"Nusa Dua beach has always been my favorite beach to enjoy. It has a white sand beach and it has a quiet situation, less crowd.On the far right side,  it has good wave for surfing.  Nusa dua beach has less small coral and less gravel, which is a good spot beach for running, love it.Over all, Nusa dua beach is a good spot to enjoy your day and sunset. Enjoy!",5.0 of 5 bubbles,"Written February 18, 2021"
4,Nusa_Dua_Beach,"Nusa Dua is a beautifully laid out region that houses Bali’s most expensive and exclusive beach resorts, landscaped gardens, art galleries and museums. The Nusa Dua beach is beautiful stretch of coastline where couples can enjoy some alone time, take a stroll and soak in the beauty of the surroundings. Blue seas, frothy waves and white sands - that's bliss, right?",5.0 of 5 bubbles,"Written January 15, 2021"
5,Nusa_Dua_Beach,"White sands clear waters, WESTIN Resort day pass use pools and enjoy the beautiful beach best in Bali  grab lunch from Ikan  restaurant overlooking the beach great day Nusa Dua",5.0 of 5 bubbles,"Written December 28, 2020"
6,Nusa_Dua_Beach,"This beach is designed as a complex for  five stars hotels. Therefore, it is not as crowded as the Legian beach (Kuta).",5.0 of 5 bubbles,"Written December 8, 2020"
7,Nusa_Dua_Beach,"Nice beach and wide shore, good for walking along the waves, taking massage to relax and feel comfort while blowing sea breeze. High tide waves are never dangerous for swimming. Such a safe and lovely sea.",5.0 of 5 bubbles,"Written November 16, 2020"
8,Nusa_Dua_Beach,"Beautiful and pristine Bech with clear waters. Enjoyed a lot of water sports also like water scooter, parachutes, sea walk. A nice combination of adventure and relaxation",5.0 of 5 bubbles,"Written September 13, 2020"
9,Nusa_Dua_Beach,Beautiful and stunning view of the beach. Clear blue sky . The landscpae of this place itself is so breathtaking i cannot explain with my own words.,5.0 of 5 bubbles,"Written July 31, 2020"
10,Nusa_Dua_Beach,You arrifve and are immeditely overwhelmed by the natural beauty/serinity; you can stay there all day take in the natural beauty of the location.,5.0 of 5 bubbles,"Written May 26, 2020"
11,Nusa_Dua_Beach,"Nusa Dua are the best beaches I saw on Bali. Nusa Dua is all about beach walking, sunbathing, swimming or water sports. Walking along this beach in the evening is very relaxing.",5.0 of 5 bubbles,"Written May 7, 2020"
12,Nusa_Dua_Beach,Move to the central area. Wave and tides clean away plastic scraps and alga. Much cleaner and easy swimming,4.0 of 5 bubbles,"Written April 21, 2020"
13,Nusa_Dua_Beach,"White sand beach with chairs and some restaurants and small shops for drinks & snacks. November to May not much wind, but can get windy on shore June to October",4.0 of 5 bubbles,"Written April 12, 2020"
14,Nusa_Dua_Beach,The beach in Nusa Dua is very nice and well suited for long walks. The only sad part is that we could still find plastic garbage in the water and on the sand but people there clean it frequently.Goes to show you that we all have to do our part to clean up the oceans everywhere around the world.....,5.0 of 5 bubbles,"Written April 1, 2020"
15,Nusa_Dua_Beach,"Spent many a day relaxing on this beautiful beach, wonderfully clean and well maintained. The crystal clear warm waters were a joy to experience.",5.0 of 5 bubbles,"Written March 23, 2020"
16,Nusa_Dua_Beach,Truly a remarkable and pristine area. Can thoroughly recommend the whole area. Such a pleasure to meander along the whole area.,4.0 of 5 bubbles,"Written March 21, 2020"
17,Nusa_Dua_Beach,"Plenty of shops, bars and restaurants at very reasonable prices. Open til late but easy to get lost the first time when you’re in a hurry to catch the hotel shuttle bus!!  A lot of the restaurants will take you back to your hotels free of charge once you’ve eaten there.",5.0 of 5 bubbles,"Written March 21, 2020"
18,Nusa_Dua_Beach,Beautiful clean beach. Water perfect for swimming - plenty bars and restraunts along the coast. ......... .. ..,5.0 of 5 bubbles,"Written March 17, 2020"
19,Nusa_Dua_Beach,"This was really an all adult family vacation, so the word couples doesn’t really accurately describe the type. Our time in Bali at Nusa Dua was filled with Warm and service oriented people. If they don’t enjoy their jobs, they sure act like they do! The warmth of the people and kindness is so unexpected. They even tell you when they think you’re tipping too much. We were happy to tip because they all go over and beyond in service...and it’s always with a warm friendly smile, conversation and a real sense of appreciation.",5.0 of 5 bubbles,"Written March 13, 2020"
20,Nusa_Dua_Beach,"An amazing beach for honeymooners. Silent, breazy and well equipped with good restaurants. There are restaurants serving multi cuisine food, variety of water sports and adventure activities, on the go massages.",4.0 of 5 bubbles,"Written March 11, 2020"
21,Nusa_Dua_Beach,"Nuda dua is as oasis within Bali standard, you feel organization cleaned tropical picture. Completely different from neighboring.  I love the atmosphere! True that is it not the Iger place for those who loves Wild beach and Hard reef! This is a classic carabean atmosphere Great place",5.0 of 5 bubbles,"Written March 11, 2020"
22,Nusa_Dua_Beach,"great beach hotel. the staff were very approachable and helpful mostly to my husband who is disable. the breakfast was good, the room was very good with comfortable bed.  We will be returning to this excellent hotel. thank you Nusa Dua Beach Hotel & Spa",5.0 of 5 bubbles,"Written March 11, 2020"
23,Nusa_Dua_Beach,"Beach area is cleaned daily of rubbish and seaweed washed up on shore. Very clean area, safety buoys for swimmers, small on shore waves, great for beach walks",5.0 of 5 bubbles,"Written March 7, 2020"
24,Nusa_Dua_Beach,Perfect beach- just as you want it to be.Cleaners that made sure it was clean in the mornings. Long runs was perfect and nice swimming.,5.0 of 5 bubbles,"Written March 7, 2020"
25,Nusa_Dua_Beach,"A beach that Give you everything, Lovely sand, small and Big Waves, surfing and of Course bars, för food and drink.",5.0 of 5 bubbles,"Written March 6, 2020"
26,Nusa_Dua_Beach,"I visit this place for few time, but before always full with tour bus tourist. Now feel so relax and good place for chill not crowded.. but i love this beach and so beautiful ♥️",5.0 of 5 bubbles,"Written March 1, 2020"
27,Nusa_Dua_Beach,"Beautiful water, sand and beach!!! Pristine crystal clear water, super clean white soft sand on the beach and great open space. Very exclusive and quiet - paradise on earth!!!",5.0 of 5 bubbles,"Written February 29, 2020"
28,Nusa_Dua_Beach,Nusa dua has been my favorite beach with jogging tracks around the peninsula area making it perfect for jogs.The wave it calm that you can swim safely with the kids making it perfect for family.,5.0 of 5 bubbles,"Written February 28, 2020"
29,Nusa_Dua_Beach,"Good,  lively , safe and overall clean beach with some sea weed. Close walking distance to the water blow , Chain of good hotels along the beach.",4.0 of 5 bubbles,"Written February 28, 2020"
30,Nusa_Dua_Beach,"Much much much cleaner and more peaceful than the beaches around Kuta, worth the trip for sure if you want to chill !",5.0 of 5 bubbles,"Written February 25, 2020"
31,Nusa_Dua_Beach,It’s a beauty even watching the water being far and then in few hours approaching . The trees on the sand also beautiful and the squirrels playing around .,5.0 of 5 bubbles,"Written February 25, 2020"
32,Nusa_Dua_Beach,"It’s a beach and who does not like walking a beach. It is endless with lots of activity along the way from massage places, bars and restaurants, both low and high end. People and scenery watching at its best.",5.0 of 5 bubbles,"Written February 19, 2020"
33,Nusa_Dua_Beach,Had the pleasure of spending 10 nights in this area and after 20 years it's still beautiful and peaceful,5.0 of 5 bubbles,"Written February 18, 2020"
34,Nusa_Dua_Beach,Lovely clean white sand. Beautiful to walk along. The kids loved swimming in the perfect temperature water. Beautiful sunsets. Really beautiful place to visit.,5.0 of 5 bubbles,"Written February 16, 2020"
35,Nusa_Dua_Beach,"I first reviewed Nusa Dua beach in 2018 and commented that in late November/December the water was absolutely full of rubbish and gave it only 3 stars because of that. I want to give credit where its due and say that 12 months later it was absolutely stunning and not a single bit of rubbish could be seen. The water was warm and crystal clear, the sand well kept and plenty of time has been spent making the place look great.WI was told by a few people that the rubbish situation is seasonal as particular currents and water flows bring the rubbish into the area but that its soon flushed out. Based on my two visits (so far) that seems to be the case.So its only fair that I mention that in September 2019 it was fantastic and postcard perfect. We all enjoyed going for walks from the Novotels 2.28 Beach Club up to the Waterblow. Lots of great little bars and places to eat you can just stop in by the way and plenty of squirrels everywhere for people to feed ;)Hope its the same this later this year when we return - easily one of the best beaches in Bali, much better than the tourist traps over in Kuta/Legian. The black sand beaches up in Tabanan and Tanah Lot  are only better because there's no-one on them :)",5.0 of 5 bubbles,"Written February 15, 2020"
36,Nusa_Dua_Beach,"Perfect service from all employees, especially Suwan, Leo, Deedit, Agus and Amar.  They have made the vacation a perfect experience with friendly nature and great conversation! The food is delicious at every restaurant even in the dining room (Dream of M Burger!).  The on-site dishes have lots of delicious dishes and very delicious afternoon tea.  Can be done with more salty foods at afternoon tea. The villa is perfect.  Maintain perfect with both cleaning services that occur at breakfast or dinner.  The pool is fantastic and the jacuzzi is fantastic.  The shower was at a great pressure and of course the automatic restroom was a nice touch.  Excellent use of all the spaces through the villas.  Extremely comfortable beds and pillows.",4.0 of 5 bubbles,"Written February 13, 2020"
37,Nusa_Dua_Beach,"Beautiful beach spoilt by banks of dried seaweed scattered all over the beach and floating in the sea which was not pleasant to walk on or swim with. Sunbeds can be a bit of a problem - unless you are staying at one of the beach resorts you must pay extortionate fees for their use even if using their bar, or be chased off by the sunbed mafia!",3.0 of 5 bubbles,"Written February 11, 2020"
38,Nusa_Dua_Beach,Very nice place! Very comfortable apartament! Well organized! Vety clean hotel! The beach is 15 minute by walk 5 minute by shuttle bus! The beach you can relax not so busy!,5.0 of 5 bubbles,"Written February 11, 2020"
39,Nusa_Dua_Beach,"Needs much more TLC for it to be one of the worlds most memorable beaches, way behind the very best ones, sorry to say.",3.0 of 5 bubbles,"Written February 10, 2020"
40,Nusa_Dua_Beach,Walked every day along the beach walk. The beach was always clean.Great beach and walk fir families.,5.0 of 5 bubbles,"Written February 10, 2020"
41,Nusa_Dua_Beach,Clean and decent stretch of beach. Well maintained public beach with access to gardens alongside the beach. Certain resorts have their own sections with sun loungers but essentially this is a public beach. Not the best beach but not horribly touristy either,4.0 of 5 bubbles,"Written February 8, 2020"
42,Nusa_Dua_Beach,"Nice beach for families with less hawkers than Kuta and without the pollution/rubbish. Note, the beach mainly serves the resorts situated there, however they are open to all.",4.0 of 5 bubbles,"Written February 5, 2020"
43,Nusa_Dua_Beach,Its a nice clean beach to be in and the crowd is decent and from the better parts of the world. Enjoyed the stroll by the sands and water,4.0 of 5 bubbles,"Written February 4, 2020"
44,Nusa_Dua_Beach,"This was paradise on steroids, we had the most beautiful week in Nusa Dua and was way beyond our expectations",5.0 of 5 bubbles,"Written February 2, 2020"
45,Nusa_Dua_Beach,A relaxing beach without too many people trying to sell you things. Very relaxing. Most hotels have a private area which is tended to by staff. There is a public day bed area available.,4.0 of 5 bubbles,"Written February 2, 2020"
46,Nusa_Dua_Beach,Unless you stay at the resorts/ hotels you’re unable to enjoy the beaches.  The public beach was packed at low tide and it was dirty with garbage in the sand and water.  The resorts maintain the beaches,3.0 of 5 bubbles,"Written January 31, 2020"
47,Nusa_Dua_Beach,"Gorgeous beach, spots to sit & food & drinks available! Easy to get there from resorts. It can get quite hot down there!!",5.0 of 5 bubbles,"Written January 30, 2020"
48,Nusa_Dua_Beach,"I am Yoga Efendi, a guide and a traveler from Yogyakarta - Indonesia. Nusa Dua Area is so big area and located in 3 places of shores (depends on where you stay). The best area is the shore near The Club Med, Grand Hyatt Hotel, Ayodya Resort, and so on. Nusa Dua is a paradise for pedestrian. You wanna know my walking route? Start walking from Pura Nusa Dharma - The Club Med - Garden of Hope in Peninsula Island - Waterblow - Grand Hyatt Hotel Area - Inaya Resort's area - Lunch at Amarterra Villas (Terra Terrace) - Shopping in Bali Collection. You gonna get amazing photos and experiences.",5.0 of 5 bubbles,"Written January 30, 2020"
49,Nusa_Dua_Beach,It was nice to place to relax beach! It was great to be for swiming. It was very clean and quite water to dove in! Will recommend it,5.0 of 5 bubbles,"Written January 29, 2020"
50,Museum_PASIFIKA,"I only know Indonesia Famous Painters from books when I was at school. By visiting this museum, finally and luckily I can view many great paint from famous painter like basuki abdullah, raden saleh, affandi and many beautiful art that make your life so wonderful.",5.0 of 5 bubbles,"Written November 16, 2021"
51,Museum_PASIFIKA,"The admission price was worth what we got about the best experience. Stunning architecture, can’t-miss collections, or amazing guided tours are just a few things that can make a museum stand out. Sometimes it can be just one extraordinary piece (or the perfect background for a selfie) that makes the entire trip worthwhile.",5.0 of 5 bubbles,"Written October 1, 2021"
52,Museum_PASIFIKA,"5.the atmosphere is very cool, has many types of paintings and sculptures and is warmly welcomed The place is nice and beautiful",5.0 of 5 bubbles,"Written September 6, 2021"
53,Museum_PASIFIKA,"Learning how to enjoy art and here is the best place to start. Love the collection, the settings and staff also friendly. Vibes of modern building with various of beautiful art and culture blend well here. Simply feel like home✨",5.0 of 5 bubbles,"Written August 29, 2021"
54,Museum_PASIFIKA,"This is my first time to visit  pasifika museum, it was interesting place, the painting and statue are artistic and has own story especially about Balinese history. Very recommended!!",5.0 of 5 bubbles,"Written August 29, 2021"
55,Museum_PASIFIKA,"It's been a long time since my last visit to museum, and this museum has a lot of history from around the globe. Especially on the paintings area",5.0 of 5 bubbles,"Written August 27, 2021"
56,Museum_PASIFIKA,"Great visit !The staff were so friendly and full of explanation. The place itself is orderly divided into several rooms, look neat and clean.I personally love how they show us some paintings of Bali and Indonesia from some points of view. I highly recommend to visit this museum ❤️",5.0 of 5 bubbles,"Written May 19, 2021"
57,Museum_PASIFIKA,All the paintings also the statues are very artistic and historical! Will be back again for sure! Very recommended!,4.0 of 5 bubbles,"Written March 18, 2021"
58,Museum_PASIFIKA,Pasifika Museum is an art museum in Bali Indonesia.  which presents Asian and Pacific and various cultures,5.0 of 5 bubbles,"Written March 18, 2021"
59,Museum_PASIFIKA,This place is so wonderfull and i enjoy when i visited the place because the place very clean and very recomended for destination,5.0 of 5 bubbles,"Written January 14, 2021"
60,Museum_PASIFIKA,"The painting is very good, the place is clean, the employees are very friendly, recommended vacation spots in BALI",5.0 of 5 bubbles,"Written November 15, 2020"
61,Museum_PASIFIKA,There's a lot of painting from many painters around the world. The variety off paintings and arts are really nice.,4.0 of 5 bubbles,"Written October 24, 2020"
62,Museum_PASIFIKA,"We visit the museum few times and still amaze with their painting collections. Like never enough time to learn and admire the work maestros done at that time.I even change the direction, start it from the last room and finished it on the first room-same feeling every time. Must visit place in Nusa Dua!",5.0 of 5 bubbles,"Written October 23, 2020"
63,Museum_PASIFIKA,what a great moment in the museum. everything is just beautiful. i hope i can go back there as soon as possible,5.0 of 5 bubbles,"Written October 4, 2020"
64,Museum_PASIFIKA,A nice multicultural museum with paintings from all over the continents which is very interesting and I really enjoyed it.,5.0 of 5 bubbles,"Written August 10, 2020"
65,Museum_PASIFIKA,"Pasifika Museum gave me a new experience, I learn about traditional and modern painting. The uniqueness and difference painting and coloring techniques in Bali, Asia and Pacific. It's really amazed!",4.0 of 5 bubbles,"Written February 12, 2020"
66,Museum_PASIFIKA,"I am in no way shape or form an art critic and I usually find most art museums and galleries very pretentious however I found the museum Pacifika interesting and very unpretentious! The only problem was the museum was very hot and stuffy, with the cieling fans offering little or no comfort",4.0 of 5 bubbles,"Written February 11, 2020"
67,Museum_PASIFIKA,"Excellent collection showcasing both local and foreign artists depicting the scenes of Bali. I came specifically to look at the Affandi paintings and was pleasantly surprised to see them displayed alongside his contemporaries (of Indonesia), which made it easier for study.",5.0 of 5 bubbles,"Written January 31, 2020"
68,Museum_PASIFIKA,"We came here because some nice review from our friend, and its amazing. very beautiful art and painting. we just walk to get in here. very close with our hotel too.",5.0 of 5 bubbles,"Written January 17, 2020"
69,Museum_PASIFIKA,"A beautiful art gallery and museum;  artworks and artifacts  through the different ages of Balinese history   Art from Bali ear artists, old masters and transplants to Bali.",5.0 of 5 bubbles,"Written December 29, 2019"
70,Geger_Beach_Nusa_Dua_Bali,"Geger beach is secluded place, located in Nusa Dua area. I could say this is a hidden gem spot, usually known for nusa dua beach instead of Geger beach.If you have visited The Mulia Resort or St. Regis Bali, then you have been to Geger beach. My feedback, geger beach is clean beach due to its location with luxury hotels and it gets cleaned up everyday. You will find many chairs for sunbathing and watersports equipment rental such as scuba diving gear, Katamaran boat, snorkeling gears and surfboards.Fewer visitors are around on the southern coast of Geger Beach, and there is sundeck with umbrellas on the beach shoreline. Sundeck and umbrella, provided by the resort, for guests who stay in the resort. Hotel guests usually order drinks at the resort bar located on the beach area. Also, near the Bar area, there is a swimming pool for resort guests. Over all, Geger beach is a good white sand beach to visit and to enjoy the beach. Enjoy!",4.0 of 5 bubbles,"Written July 15, 2021"
71,Geger_Beach_Nusa_Dua_Bali,Plenty of sunbeds + umbrellas. We payed 100k per pair. Food and massage service available. Local lunch 50k IDR/ person (approx) incl. fried rice and a cold Bintang :),5.0 of 5 bubbles,"Written November 7, 2020"
72,Geger_Beach_Nusa_Dua_Bali,The perfect time to go to Geger beach is for sunrise. It is so peaceful and mesmerizing sunrise!Remember to check the tides information before you go there :),5.0 of 5 bubbles,"Written September 20, 2020"
73,Geger_Beach_Nusa_Dua_Bali,"This place is not well known yet. It makes it special because it has less visitors. Most of them was local people. Just need to pay IDR 5000 for the parking lot. If you don't really like beach, this place it's worth to visit.",4.0 of 5 bubbles,"Written February 28, 2020"
74,Geger_Beach_Nusa_Dua_Bali,Pisma is a first class food handler and a great conversationalist if you want to chat . Maguro is usually pretty busy But if you get there early sometimes there is time to chat I really enjoyed her. JONO HODI is also a great guy And goes out of his way to make your dining experience perfect. As a matter of fact we all became friends now on Facebook and we do talk time to time.,5.0 of 5 bubbles,"Written January 8, 2020"
75,Geger_Beach_Nusa_Dua_Bali,Nice view but uncomfortable too swim because of seaweed and rocks all over the tip of the beach. For laying down on top of the sand its a bit disgusting because lots of dogs roaming around eventhough with the owner. Renting a sunbed is recommended for a cozy afternoon sunbathing. Get a day pass from Mulia Hotel is also another luxury options.,4.0 of 5 bubbles,"Written January 7, 2020"
76,Geger_Beach_Nusa_Dua_Bali,My other options of the beach when i am in nusa dua. Beautiful and clean beach with few choices of restaurants. Our favorite thing is laying on to tan with drinking coconut. You can see also some fishers around. Recommend place if you are around nusa dua.,5.0 of 5 bubbles,"Written January 6, 2020"
77,Geger_Beach_Nusa_Dua_Bali,"The beach is very nice, sandy, very long for a nice walk and not too crowded even it was during the new year holiday. The sea is nice even if in the water there are many algae’s from the sea. But it is the right place for a relaxing day on the beach in Nusa Dua area outside our resort",3.0 of 5 bubbles,"Written January 3, 2020"
78,Geger_Beach_Nusa_Dua_Bali,"This beach is one of the best spots for watching sunrise, doing some yoga or just relaxing in nusa dua area.",4.0 of 5 bubbles,"Written December 12, 2019"
79,Geger_Beach_Nusa_Dua_Bali,Decent beachNot as pretty as some photos on review sites Bigger than some other beaches. Water was warm and clear even though a bit of litter Sand was relatively softGood place to spend a few hours,4.0 of 5 bubbles,"Written December 4, 2019"
80,Geger_Beach_Nusa_Dua_Bali,Very beautiful beach and clean.  We had beautiful time there even a bit far. So many small boats put there that made the area was not so clean but the ocean was clean. Some people swam there with their family and playing with full of joy made us smile also. It us a good place for family to spend time at the beach.,4.0 of 5 bubbles,"Written December 1, 2019"
81,Geger_Beach_Nusa_Dua_Bali,"We were based in Seminyak and wanted to get away from the hustle and bustle.  It worked out great! Lovely sandy beach,  not too crowdy, with some bars and restaurants to have your lunch at. What more do you need?",5.0 of 5 bubbles,"Written November 22, 2019"
82,Geger_Beach_Nusa_Dua_Bali,"Peace full and magical place. Nice sand, cool& clean water. There are also bars for refreshing drinks.",5.0 of 5 bubbles,"Written November 6, 2019"
83,Geger_Beach_Nusa_Dua_Bali,"Stayed at Swissbel which had shuttle service good clean beach next to Mulia resort expect to pay 100k rupiah for 2 loungers ,food good from both restaurants but the !st on the left does not charge tax so little cheaper one of the best beaches we have been to in Bali.",4.0 of 5 bubbles,"Written October 30, 2019"
84,Geger_Beach_Nusa_Dua_Bali,"This beach is clean, beautiful and child friendly. Its better than the other beaches are visited when I was in Bali.",5.0 of 5 bubbles,"Written September 5, 2019"
85,Geger_Beach_Nusa_Dua_Bali,"White sand, clean water and quite surrounding, the right mix to enjoy a peaceful time and relax while contemplating the sea of Bali.Get your Yoga skills with you and take 30-60' of it on the sand.I like this beach",5.0 of 5 bubbles,"Written September 3, 2019"
