,location,content,rating,date
1019,Yeh_Pulu_Temple,Our driver didn't even know where this one was. Not a lot to see. Nice cravings after hiking a half kilometer or so through jungle and rice fields. Right next to goa gijah.,3.0 of 5 bubbles,"Written October 8, 2018"
1020,Yeh_Pulu_Temple,On the way in a walk along padi fields & greenery. The wall sculpture around 100m built in the 14-15th century is very unique with a short storyline of the lives in those days.,4.0 of 5 bubbles,"Written October 7, 2018"
1021,Yeh_Pulu_Temple,"This is something all the guide books say you should see.   In my opinion they are right.  Interesting, impressive, and wonderful workmanship.",5.0 of 5 bubbles,"Written October 5, 2018"
1022,Yeh_Pulu_Temple,"Yeh pulu temple is located at bedulu village, just take 10 to 15 minutes by drive from ubud center area 🚙🚗Here you will be spoiled by stunning ancient relief The relief has around 26meters long and 2 meters tall The relief saying about daily life around that century,  the farmer, animal hunting, women in comunity 🌴🌷🐴",5.0 of 5 bubbles,"Written September 15, 2018"
1023,Yeh_Pulu_Temple,You can reach the Temple either direclty either through the rice fields. The best is to take the Guide of the Temple who will show you the way and explain a lot in a good English. It was a real nice moment.,4.0 of 5 bubbles,"Written September 11, 2018"
1024,Yeh_Pulu_Temple,"When I first time come there that was a amazing place that ever i visited, but now everything was changed, but i'm happy",5.0 of 5 bubbles,"Written August 17, 2018"
1025,Yeh_Pulu_Temple,"Went during peak tourist season and this place was deserted.  The reliefs, which date to the 14th century are amazing.  Really enjoyed this place.",5.0 of 5 bubbles,"Written August 13, 2018"
1026,Yeh_Pulu_Temple,"A lovely little stone carving temple discovered in the rice fields dating back maybe to 1450.Entry fee reasonable (I think around 45,000 IDR) for our family of four.But the guide then explains he does the tour for free and any donation at the end would be welcome to benefit the kids of the village.  He won’t talk money again he says (a white lie as you will discover later).The guide doesn’t have far to go, and not much to say, but he is a great guy and points out other things like a venomous green mamba snake in a tree, which was great!The temple itself is a smallish stone carving of village life some 600 years ago, also lovelyBut after 20 minutes at the end I give the guide 60,000 IDR as a voluntary donation to say thanks (as longer tours of major temples can be around 100,000 IDR) and he is not happy!? He explains he should be paid 150,000 IDR, what a con! I tell him no that’s not right and he goes on to explain something about being a farmer ? He doesn’t overly persist but does press the matter a little . I politely refused paying extra.  It left a taint, if he expects so much more than the big temple guides he should say so upfront and we would say “no thanks” up front.  He was with the ticket box attendee and was legitimate, but a scammer nonetheless, be warned, go to other temples instead like Goa Lawah elephant cave which is nearby and give this a miss...",2.0 of 5 bubbles,"Written August 9, 2018"
1027,Yeh_Pulu_Temple,"Not a ""tourist attraction"" like Disneyland... Worth n´visiting for anybody who is interested in the real Bali, before it became a tourist attraction...",5.0 of 5 bubbles,"Written August 7, 2018"
1028,Yeh_Pulu_Temple,"Nice rice fields, but the temple is small, the cravings are also like 1,5m so it's good for a nice walk if you are around, but not worth dislocation from afar.",3.0 of 5 bubbles,"Written August 5, 2018"
1029,Yeh_Pulu_Temple,Yeh Pulu is a hidden gem nestling in a peaceful landscape of ricefields and breathtaking views. There is a peaceful atmosphere and few tourists there which makes it a haven of quiet contemplation. Amazing sculptural friezes. Well worth visiting!,5.0 of 5 bubbles,"Written July 29, 2018"
1030,Yeh_Pulu_Temple,It was quiet when we arrived so it was very enjoyable. Easy access and very beautiful to explore.Quite amazing!,4.0 of 5 bubbles,"Written June 20, 2018"
1031,Yeh_Pulu_Temple,"Be prepared to walk a little less than 10 minutes down through a well-tended garden path to get to the reliefs.  They look very old, and it is actually quite moving to see these life size alto-relief carvings right next to you: no rope, no obnoxious signs or guards, just you and history.  Can be a little hot in midday, so better to go in late afternoon or morning, but if your schedule allows for only a noontime visit, GO.  Well worth the detour from your other places of interest east of Ubud.",5.0 of 5 bubbles,"Written June 18, 2018"
1032,Yeh_Pulu_Temple,"You have to pay the parking if you come by motorbike, it's 5000 Rp. The entrance is 15000 Rp. You pass through a rice field and after you can see the temple. It's a tiny one and you can visit in 30 min. But the place is quiet and lovely if you go early. We were only my friends and me. You can go around the rice fields.",4.0 of 5 bubbles,"Written April 12, 2018"
1033,Yeh_Pulu_Temple,"This is actually not a temple, but a series of carvings in a stone cliff face. However, it is considered holy so a sarong is needed to visit here. They are provided for free if you forget to bring one. The place is actually named for the tiny sacred spring on site, where people come to collect the water for ceremonies. There was a man offering to explain everything for about Rp50,000, though it is not necessary. I was the only one there  during my visit, and I was blessed with holy water from a very old lady who looks after the site. It is worth a look at the old carvings and it is a very peaceful experience. There are toilets on site and one restaurant.",4.0 of 5 bubbles,"Written March 28, 2018"
1034,Yeh_Pulu_Temple,"IDR 15,000 entry but also forced to take a guide ehich we only gound out about after entry. Now the 'donation' for the guide expected as IDR 50,000 for four people. Apparantly the guide fee goes to a local orphanage so at least it was a good cause.2174",3.0 of 5 bubbles,"Written January 27, 2018"
1035,Yeh_Pulu_Temple,"Surprisingly devoid of tourists, this place is well worth a visit.Carvings on the wall are well preserved.Only one wood carver on site but he was not pushy and gave good info. So we bought on of his carvings .",4.0 of 5 bubbles,"Written January 15, 2018"
1036,Yeh_Pulu_Temple,First time to this temple & I was very surprised at how gentle & blissful the energy was.  The carvings & the history were amazing.,5.0 of 5 bubbles,"Written January 6, 2018"
1037,Yeh_Pulu_Temple,"This place I recomend to visit only if  you not far or after Elephants cave. You don't need a guide here. Temple is uniqe, very quite and not crowded . The rice fields are around. We spend there near 15min and made cool photos.",5.0 of 5 bubbles,"Written November 27, 2017"
1038,Yeh_Pulu_Temple,A beautiful walk to the small temple in the jungle. We were blessed by a local and learned the history of the wall carvings. A nice little stop that we would recommend if on the way.,4.0 of 5 bubbles,"Written November 17, 2017"
1039,Yeh_Pulu_Temple,"We came here after we visited the Elephant caves and we found this gorgeous place to be so mesmerising, calm and unique. We had a super friendly tour guide who took us for a stroll through the rice paddies before going to the temple and he was patient in sharing his local knowledge and the story around the beautiful carvings in the temple. There was nobody else around, very quiet and peaceful. We thoroughly enjoyed our visit and didn't feel like 'one of the many' tourists. Would very much recommend going for a different temple experience in Bali.",5.0 of 5 bubbles,"Written October 29, 2017"
1040,Yeh_Pulu_Temple,"We visited Yeh Pulu temple as a last-minute choice whilst traveling around and were very satisfied. After having visited many temples all throughout Indonesia I've always felt a bit 'templed out'! However, wanting to renew my knowledge and practical experience of Hinduism, and introduce the Bali temples to my partner, we visited here. Our guide was very knowledgable and took his time explaining everything about the temple including the stories behind the stone wall carvings. It is a short walk through rice paddies and well worth the trip.",5.0 of 5 bubbles,"Written October 15, 2017"
1041,Yeh_Pulu_Temple,"One of the most interesting temples we saw in Bali, also because it's one of the oldest and virtually no one seems to have heard of it. The place was empty of tourists.",5.0 of 5 bubbles,"Written September 16, 2017"
1042,Yeh_Pulu_Temple,"The entrance fee is 15K, it's very close from Goa Gajah to here. Be careful for the guys who want to be your guides - you don't need a guide here and the guy wanted 150K from us. Temple and the rice fields around it are nice for a short visit (30min).",4.0 of 5 bubbles,"Written August 24, 2017"
1043,Yeh_Pulu_Temple,Relief Yeh Pulu is located in Bedahulu village just 15 minutes drive from Ubud. The relief is the figures carved on the cliff just about 25 meters length. The relief tell us about the life in the olden time in Bali... nice place to visit because that area also offer  you nice view of rice paddies... have a sweet holiday...thanks. Artha,5.0 of 5 bubbles,"Written August 19, 2017"
1044,Yeh_Pulu_Temple,"This temple is located close to Goa Gajah Temple. To get to the road to this temple will be displayed beautiful scenery. This temple is very small, but nice to meditate. A very place worth to visit.",4.0 of 5 bubbles,"Written August 13, 2017"
1045,Yeh_Pulu_Temple,"This site is not often visited by tourists, said our guidebook. And now we know why: there's not really much to see and self-appointed so-called guides try to get your money.",2.0 of 5 bubbles,"Written August 12, 2017"
1046,Yeh_Pulu_Temple,Beautiful walk down into a valley with the family. Enjoyed a historic remnant of the Hindu kingdom in this part of Bali. A small river at the bottom to cool off with a splash of water. If you manage the steps if you have young kids then it is worth the visit,4.0 of 5 bubbles,"Written July 15, 2017"
1047,Yeh_Pulu_Temple,"It's just one wall covered in carvings. It's nice and chances are you'll be alone. As it's close to Goa Gajah, you should check it out, but don't make it a destination.",3.0 of 5 bubbles,"Written June 7, 2017"
1048,Yeh_Pulu_Temple,"Don't expect a lot, but expect a small jewel. Absolutely stunning and very well maintained. You are 'obliged' to get a tour guide at the entrance, welcome the experience to chat to them and don't get upset, if you are 'forced' to give a little donation, these people are very poor and if you we, as we can afford our ticket to Bali....are rich, nevertheless often we are not in our home countries.",5.0 of 5 bubbles,"Written June 5, 2017"
1049,Yeh_Pulu_Temple,"Very old Hindu bas relief carvings, but the real point of coming is the walk down the valley, which is beautiful. If you are wearing shorts, they will lend you a sarong at the entrance.",4.0 of 5 bubbles,"Written May 26, 2017"
1050,Yeh_Pulu_Temple,Interesting stone carvings from many centuries ago that represent different life scenes. An old lady at the bottom sprinkled me with holy water. That was a first for me!,3.0 of 5 bubbles,"Written May 19, 2017"
1051,Yeh_Pulu_Temple,"Quite place, peaceful, zen atmosphere, many statues of an other creed , religion, a holy place, Indonesian's Sundaislands faith; to visit temple is instinctive, sensitive and overall mysterious.",5.0 of 5 bubbles,"Written April 12, 2017"
1052,Yeh_Pulu_Temple,"Its a lovely walk through rice fields to the ancient carvings (and old lady tending them and posing with you for photos and a gratuity...) but I think you're better off reading up on the place than having a guide tag along. I found his prescence and superfluous chatter more an annoyance than help. I would have preferred to be left alone to enjoy the lovely ambiance of the walk.That said, its a delightful and unique spot.",4.0 of 5 bubbles,"Written March 22, 2017"
1053,Yeh_Pulu_Temple,"Visited this temples on late afternoon and no many people there. We are impressed by the statues ..so many,,,,If you like to avoid crowded just come here!",4.0 of 5 bubbles,"Written March 18, 2017"
1054,Yeh_Pulu_Temple,"This was a hard place to find,  but so worth it.  This is a place hardly anybody comes to.  Its hidden and well worth the find.  Go check it out .   It is right around the area of Elephant Cave.",5.0 of 5 bubbles,"Written March 18, 2017"
1055,Yeh_Pulu_Temple,"We stumbled across this place and were thrilled. It's different to everything else in Temples and the carvings are superb. The carvings are extremely old and unfortunately there wasn't alot of information about them but it doesn't detract from their beauty. Many of the locals of course, know about this place and some come here for prayer and offerings.Only about 25kms from the centre of Denpasar you can get any taxi driver to take you there. It was only discovered just under 100 years ago so something of a treasure really.There isn't much around but like everything in Ubud, walk a few 100 metres and you'll come across people, petrol, food, drinks etc.Enjoy.",4.0 of 5 bubbles,"Written March 16, 2017"
1056,Yeh_Pulu_Temple,Saw a lot of statues with many kind of impression. Walked and explore with a guide! There are interesting history of this temple.,5.0 of 5 bubbles,"Written March 2, 2017"
1057,Yeh_Pulu_Temple,"26 Km from Denpasar airport is known for relief tourist attraction is located in Banjar Batulumbang,Bedulu village, it was first discovered in 1925,this place is not only an archaeological heritage site but it is also has beautiful rice field and cliff and easy to be reach because it is situated on Kintamani tourism track.",4.0 of 5 bubbles,"Written February 13, 2017"
1058,Yeh_Pulu_Temple,"Very quiet and off the beaten path. After going to other temples and seeing far too many tourists around, it was nice to go to a more secluded area. It seemed far more spiritual for that reason. The walk was gorgeous, surrounded by rice plantations and beautiful trees and a small waterfall and flowing stream. Once there, there was a large rock with a gold inscription that was beautiful. The statues along the wall were well looked after, but also seemed very historical which I loved! One of my favourite places in Bali yet!",5.0 of 5 bubbles,"Written February 6, 2017"
1059,Pura_Samuan_Tiga_Temple,"Since I stay with Balinese friends in Bedulu (=Bedahulu village), the Pura Samuan Tiga is more or less ""THE TEMPLE"" where the family goes for celebrations. This year was a big 12 days celebration from April 17th to 29th with all kind of activities. People from many communities around the Ubud area bring their holy temple symbols (the Rangda costumes and masques, the Barong, the temple shrines and others) to the temple to be blessed. They bring incredibly huge offerings (towers of fruits, rice cakes and decorated with ornaments made from young palm leaves and flowers) which get blessed with holy water by the Hindu priests. The intent sticks and some money on top are for the temple, the beauty of the colors and smells are for the gods, the edible parts are take home again for the family. There are Gamelan orchestras playing, people moving and singing and priests reading from the holy scriptures. Our friend took us for two evenings to the temple (dressed in the usual temple dress: Sarong, Blouse and Selendang for the ladies, Sarong, Shirt, Selendang and Headdress for the males and sandals or flip-flops on the bare feet). On the first afternoon we saw the processions of the different Banjars (communities) arrive with their temple things and circle three times the area of Samuan Tiga. Then there was the run of the ladies (long black skirts, white blouse, red selendang) and men (all in white) around the temple. They hold hands and run in waves symbolizing the waves of the sea. After three rounds the men take from the heaps of discarded decoration and put the dry palm leaves like hats on their heads. After one more round  they sit in front of the priests to get blessed and then hit each other with the dry palm leaves. This symbolically drives out all bad thoughts. Now the temple and the people are cleansed and ready for the arrival of the goods. (Physically - in our eyes - the temple is more dirty than ever, rubbish laying around everywhere.) In the evening the school children and some ladies show special dances in beautiful costumes accompanied by Gamelan music. Again, the beauty of the dancers, the dances and the music is mainly for the gods, not necessarily for the onlookers, who talk, eat, come and go and let their children play. It is definitely not a show in our sense. Everybody who wants to look stands or sits crosslegged somewhere on the floor.If there is no ceremony, the temple is just a big area of stairs, temple shrines, and the huge holy banyan trees. Certainly worth seeing as well, but nothing in comparison to celebration times and preferably guided by somebody who knows about the meanings, like for example our friend, guide and driver I Nyoman Darna from Bedulu.",5.0 of 5 bubbles,"Written May 1, 2019"
1060,Pura_Samuan_Tiga_Temple,Lovely place to see Bali’s culture through this temples and love for their religious beliefs. I was amazed at the buildings and how well they are maintained I would definitely recommend as part of a day tour,4.0 of 5 bubbles,"Written April 20, 2019"
1061,Pura_Samuan_Tiga_Temple,"Temple is beautifull place it Is full of spirit. Temple keeper can take you to ""secret temple"" in the forest. ;)",5.0 of 5 bubbles,"Written January 23, 2019"
1062,Pura_Samuan_Tiga_Temple,"As previous temple reviews, a must see in Ubud. Again during festival period of January, so very busy, but worth the visit.",4.0 of 5 bubbles,"Written January 13, 2019"
1063,Pura_Samuan_Tiga_Temple,"This temple was part of our tour from Ubud to Candidasa.  We were not impressed that we had to pay extra for the guide after paying the entrance fee.  Apparently we should never have paid extra.  A shame when this happens as it leaves a bad taste in one's mouth.  There are hundred of stairs, so given our age, we only made it half way up the temple which was also disappointing.",3.0 of 5 bubbles,"Written November 8, 2018"
1064,Pura_Samuan_Tiga_Temple,"We saw so many gorgeous temples in Bali, each unique in many ways. This one was really not worth it. It's obvious that it gets few visitors because it was deserted, dusty and not well cared for. Forlorn is the best word I can come up with.",2.0 of 5 bubbles,"Written October 11, 2018"
1065,Pura_Samuan_Tiga_Temple,We took a 100000 taxi ride to this temple then walked to the elephant temple. This one was by far the more interesting of the two. Very very quiet and without the shops selling the same goods. It's a more open site than many of the temples we visited. Not too touristy. Dress appropriately as you don't be provided with a sarong to cover up with.,4.0 of 5 bubbles,"Written July 20, 2018"
1066,Pura_Samuan_Tiga_Temple,"Nothing much but just ""small structures"" (all together resembling like a village or such) are what to see at this temple where you'll also see a number of small stone statues & sculptures either around those structures or at the end of the stairways (especially all the way at the back where there's this one stairway with those statues alongside leading up to like a gate with also a big face-like carving above it); better than walking around its grounds though, I actually liked viewing this temple from the slightly-higher areas (one at the front end & one at the back end of the temple grounds).  In any case, it's not what's at the Temple but what's ""not"" at the Temple that makes this temple ""unique"" among the ones that I visited in Bali, and that unique thing about the Temple is its ""quietness"" (due to the lack of visitors); me & the two people on my car tour were like ""literally"" the only visitors at the time although there was also a group of local people praying or such (but then I'm also not sure why our tour would have brought us here if the Temple were not one of ""significance"").I came here with Perama (which cost about 330,000 rupiah for a car & a driver although you'll also have to wait for some other people if you're just by yourself like I was); being the second of the six places on the tour, this was preceded by Pura Goa Gajah (with the so-called Elephant Cave that you can go inside although there's really nothing interesting inside) and followed by Pura Gunung Kawi (with some big rock-face carvings on the temple grounds ""way down below""), Pura Tirta Empul (with its ""popular"" bathing pool), Kintamani area (with an ""excellent view"" of Mount Batur volcano) & Tegalalang Rice Terrace (where it's not just looking from above but you can be ""in the terrace"" by going down then going up on the other side).",3.0 of 5 bubbles,"Written June 26, 2018"
1067,Pura_Samuan_Tiga_Temple,This temple which is actually a collection of shrines so that each area through its shrine may also have access to religion and prosperity.,4.0 of 5 bubbles,"Written June 25, 2018"
1068,Pura_Samuan_Tiga_Temple,"If you wish to visit an authentic traditional Balinese Temple which are not thronged by thousands of tourists and souvenir peddlers, come to this place! The most amazing thing about this place is: it is located just down the road from the Goa Gajah(Elephant cave) temple which attracts thousands of tourists every day. When my friends and I came here, there were no tourists at all, only a few local families offering prayers in the compound of this temple.Come here to experience the peace, serenity and harmony of a real Balinese temple.",5.0 of 5 bubbles,"Written May 23, 2018"
1069,Pura_Samuan_Tiga_Temple,"I visited this Temple in the early seventies and it has gone through some changes, But is still one of my Favourtite Temples to visit. It was here the joined the the three coloured strings to make the Tri Datu bracelet that most Balinese where, symbolising the thre dieties Brahma (red) Vishnu (black) Ciwa (white) . This is one of the First Temples in Bali and its name means the joining of the three Threads (tri datu)",5.0 of 5 bubbles,"Written December 22, 2017"
1070,Pura_Samuan_Tiga_Temple,"Our driver, drove us here after visiting the elephant caves located less than 1 km away, It is about 5 km from the tourist hub Ubud. However this place was comparatively quite. Our guide tells us, that this is the venue for the great meeting of the gods, deities, and saints. You need to wear a sarong to go in. We carried our personal sarongs, and we suggest that, when visiting Bali, one of the priorities before starting the temple tours is to buy a personal sarong for yourself. It is cheaper and more hygienic. This temple differs from other Bali temples in that there are 7 courtyard compared to the normal 3. The innermost courtyard is supposed to be the meeting hall of gods, deities and saints. Here there are numerous shrines compared to other inner courtyard of Balinese temples. The unique architecture and stunning view  are a  pleasure to the eyes. However it tends to be warm therefore bring along a bottle of water, sunblock, and a hat. For me, this temple is a must visit, and a trip here is worth it.",5.0 of 5 bubbles,"Written August 31, 2017"
1071,Pura_Samuan_Tiga_Temple,"Put Pura Samuan Tiga on your list if you are visiting Goa Gajah, they are a hop, skip and a jump away from one another, (less than 1 km) and the contrast is amazing, going from the heavy tourist site of Goa Gajah to being by yourself at Pura Samuan Tiga.  The temple is 5km from Ubud and offers the peace and tranquillity the more remote larger temples offer away from the city, and you don’t have to fight your way though a plethora of people selling souvenirs.The temple was built 10th century and was the sacred royal temple of the Warmadewa dynasty.  Tiga = three and Samuan = meetings, it is believed it is the “venue for the great meeting of the gods, deities, and saints”.  The temple has seven courtyards instead of the usual three.  The banyan tree near the entrance is stunning.  Much of the temple was destroyed by earthquake in 1917 and was rebuilt by Bali’s beloved architect, I Gusti Nyoman Lempad, whose many achievements also included Pura Taman Saraswati in Ubud.",4.0 of 5 bubbles,"Written July 13, 2017"
1072,Pura_Samuan_Tiga_Temple,"When I visited, I was the only person here so it was nice to enjoy the complex to myself. If you have a scooter / transport it's located several km from Ubud so not far at all. I couldn't enter the main temple but I took a few nice photos. Walking around was pleasant, but I didn't spend too long here. If you have visited many other temples, then perhaps give this one a miss. Entry fee 10k IDR",3.0 of 5 bubbles,"Written June 7, 2017"
1073,Pura_Samuan_Tiga_Temple,Very nice place to visit.Had the opportunity of seeing local people performing ceremonies at this place.All the ladies colourfully dressed with prayer stuff on their heads.,5.0 of 5 bubbles,"Written April 26, 2017"
1074,Pura_Samuan_Tiga_Temple,"The address is wrong do not try to use Uber to get to this temple the address is actually someone's home, temple is another 30mins away. The area Ubud do not like Uber.",1.0 of 5 bubbles,"Written April 15, 2017"
