,location,content,rating,date
1531,Museum_Puri_Lukisan,"What an amazing setting and admission includes a delicious lunch with dessert and drink. We found this place to be a great mix of the modern (marketing 3.0 exhibit - doesn’t even require admission ticket) and the very old - early 19th century tapestries. Then in other spaces, mixed in, were 20th century paintings and sculptures. And, then to top it off, 21st century paintings in which many were for sale. This was a relaxing oasis from the busy bustling streets of Ubud, but located in all the action.",5.0 of 5 bubbles,"Written December 30, 2018"
1532,Museum_Puri_Lukisan,This museum is not far from the Palace & Starbucks. An easy walk from Ubud center. Amazingly the admission includes lunch! Beautiful grounds and plenty of fantastic Balinese Art through the ages.,5.0 of 5 bubbles,"Written December 30, 2018"
1533,Museum_Puri_Lukisan,"I paid 115,000 Rp for a small lunch and entrance fee. There lunch was fine, the highlight was the fruit platter. The four buildings had paintings and wood carvings from different time periods with excellent write-ups in English throughout. I enjoyed seeing the transitions between religious themes and daily life depictions. The works are not in a climate controlled setting, so enjoy them while you can, many will not last long in this humidity.The grounds were gorgeous and a band played in one of the pavilions throughout my whole visit. It was a great way to spend two hours.",4.0 of 5 bubbles,"Written December 21, 2018"
1534,Museum_Puri_Lukisan,"The place is in mid of ubud town, 4 building with mostly painting, the entrance fee is idr85000 which is very expensive there is one gallery with painting for sale new painting with high price",1.0 of 5 bubbles,"Written December 15, 2018"
1535,Museum_Puri_Lukisan,Nicely curated art museum showcasing balinese art across extensive period of time. Beautiful gardens. Only downside was lack of air-conditioning which in late November heat was draining.,4.0 of 5 bubbles,"Written December 4, 2018"
1536,Museum_Puri_Lukisan,Multiple buildings of art exhibits. Reasonable entrance fee which includes tea (additional lunch add). Nice old temple-like atmosphere.,4.0 of 5 bubbles,"Written November 15, 2018"
1537,Museum_Puri_Lukisan,"A fabulous insight into traditional Bali art. Four galleries located in a beautiful garden setting.Three provide a time-line of both painted and sculpted art, with the fourth displaying modern Bali art (some of which is for sale).If you appreciate traditional Bali art, the artworks are truly magnificent.N.B. The Rp85,000 admission price includes a cold drink at the end of your self-guided tour.Highly recommended.",5.0 of 5 bubbles,"Written November 14, 2018"
1538,Museum_Puri_Lukisan,"Four different buildings housing a range of paintings with one housing the history of the museum and a temporary exhibition. There are also woodcarvings, A couple of hours here takes you through the exhibition and gives you an insight into Balinese art. The entry fee also includes a drink and there is a more expensive option which includes lunch.",4.0 of 5 bubbles,"Written November 14, 2018"
1539,Museum_Puri_Lukisan,"It is a 5 building art musum with a really nice garden with paintings and old traditional stuff from the history of Bali.There are only few people, so you can run away from the crowd here.There is a local person who plays his instrument all day long, and you can just sit for a while under a tree, and enjoy the sound.For the entry fee (around 115.000 RP, it is about less, then 7 EUR) you will also have a really nice lunch with drink! What a bargain! Do not miss it!",5.0 of 5 bubbles,"Written November 5, 2018"
1540,Museum_Puri_Lukisan,"Ubud, itself, is  a most beautiful place in the mountains. It is known as the village of artists. The Puri Lukisan Museum is clean and well-kept with good toilet facilities - always an important factor when travelling overseas. Famous Bali  painters and sculptors exhibit their works of art some of which are available for purchase. The colours in the paintings are very striking. There is a range of oils, water colours, etc. It is a pleasure to wander through the various rooms to view the different types of art as everything is tasfefully displayed. As might be expected, the art has a definite Balinese/Asian influence. We fell in love with Ubud itself. If we had known how delightful it was we would have stayed there instead of in south Kuta! Granted, it is not near a beach but most of the hotels do have swimming pools. We went on a half-day trip but regretted not spending at least a day there.  The countryside is spectacular, the variety of shops is amazing and there are cafes galore. However,  prices are definitely high than in beachside Kuta becuse the area is much more upmarket. We noticed that there were many more tourists at Ubud than in Kuta during the time we were there. A visit to Ubud is an absolute must!",5.0 of 5 bubbles,"Written October 14, 2018"
1541,Museum_Puri_Lukisan,"I think my title says it all.  We almost didn't go in here because it wasn't on our list of top things to do in and around Ubud.  We're so glad that we did. There were very few people in there and the grounds are fairly extensive. Four buildings with Balinese art surround beautiful grounds, gardens, fountains, and pools. There was live gamelan music being softly played in a corner of the grounds, making the whole experience very zen! Even if you're not an art lover, this is a place to get a break from the madness of the Ubud streets for a very low price.",4.0 of 5 bubbles,"Written October 11, 2018"
1542,Museum_Puri_Lukisan,"Cheap entrance, good guiding,  eautiful surroundings, a good retrospective cut through decades of Balinese art, music and others, including sculpture and design.",5.0 of 5 bubbles,"Written October 8, 2018"
1543,Museum_Puri_Lukisan,Beautiful museum with four buildings of art and carvings. Nice to wander when it's hot everywhere...loved the various styles of paintings.,3.0 of 5 bubbles,"Written October 3, 2018"
1544,Museum_Puri_Lukisan,"There is Balinese art here that ranges back to the 1600s right up to present day, that is painting and wood carvings. It is spread across four buildings each housing a different era in time. The buildings are not air conditioned but have fans and small windows so are relatively cool no mater how hot outside. There are also a few fish ponds and gardens to walk through between the buildings. There is a coffee shop which also serves lunch with plenty of seating. There are two ticket types 85,000idr (£5) which includes a free drink or 125,000idr (£7.35) which includes some food. We only had the 85,000idr ticket and didn’t eat here so cannot review the food or portion size.",4.0 of 5 bubbles,"Written October 3, 2018"
1545,Sari_Api_Ceramic_Studio,I really enjoyed my ceramic workshop there in a peaceful environment and good teaching.  Thanks a lot!,5.0 of 5 bubbles,"Written April 25, 2020"
1546,Sari_Api_Ceramic_Studio,"I did one day course with Susan and I was extremely impressed on her way to explain step by step each process: from clay composition to glazing. She pushed me to use the wheel, stepping out of my comfort zone. Moreover, she has kindly offered to glaze my bowl and send them to Australia. The studio is beautiful and peaceful, surrounded by nature, lush! Cannot recommend Susan and Sari Api studio more. Thank you again for the wonderful experience.",5.0 of 5 bubbles,"Written March 18, 2020"
1547,Sari_Api_Ceramic_Studio,"I went in November 2018. I had so much fun, such an experience they were so nice. I would definitely recommend here, they were patient, it’s definitely family friendly, I went as a couple. I wouldGo back 🤗",5.0 of 5 bubbles,"Written December 1, 2019"
1548,Sari_Api_Ceramic_Studio,"I always wanted to take classes in pottery. Susan was a terrific teacher who explained the basic rules in the 3 hour class I signed up for. Had a good conversation too. Definitely a memorable experience. Susan provided a good overview and was helpful. I liked the pace of class. Susan also ships your pieces once theyare fired and glazed in the kilns. I am looking forward to receiving mine. Next time, I might go for a full day class.",5.0 of 5 bubbles,"Written February 22, 2019"
1549,Sari_Api_Ceramic_Studio,"Traveling solo I was looking for things to do in Ubud. This was a pretty good day well spent with Agus at Sari Api. It brought back a lot of memories from studying ceramics in high school. Agus took the group of 3 through the 3 hand building techniques followed by time on the pottery wheel. Agus makes it look easy but it in fact is quite challenging. It was still fun and Agus was very helpful. I made 4 things, 1 slab, 1 coil, 2 on the wheel, and have organized to have 3 of them, that I liked, shipped back to Australia. Agus will fire them multiple times and apply the chosen glaze and send them on over. I will see them in 81 days! 👍🏼The only snag was the location of the studio. It was super easy to get to via taxi or motorbike but getting someone’s attention on the way back was a little tricky. I was super lucky to get a lift back to town with people from the class. A shout out to them!! 👌🏼",4.0 of 5 bubbles,"Written January 3, 2019"
1550,Sari_Api_Ceramic_Studio,"It is a small shop hidden not far from Ubud where on Saturdays (and only on Saturdays) it is possible for the kids to do some ceramic. The price is very reasonable, about 5€ for 90 minutes and the children have a blast building something with their own hands.It is important to arrive a little bit early as the course is limited to 22 kids and it also worth to mention that if like us you are tourist, it will not be possible to take back home the work that has been done as it takes 3 weeks to dry.Final point, there are some other courses but I cannot comment on them as we only did the introduction for children.",5.0 of 5 bubbles,"Written March 31, 2018"
1551,Sari_Api_Ceramic_Studio,We had an amazing 3 hrs learning how to make about four to five different items. Highly recommend if you have kids with you.  The big kids liked it even more.  My husband and our friend Freddie got way into it. Susan was very helpful and funny.  Great hands on experience!,2.0 of 5 bubbles,"Written July 18, 2017"
1552,Sari_Api_Ceramic_Studio,My husband and I were on a visit to Ubud and came across Sari Api. We did a one day on the wheel course and it was great. We had no previous experience with ceramic but enjoyed the setting and had fun playing with the wheel doing both a few bowls and cups. Thio Agus was our instructor and he was quite good in explaining to us the basics and giving us plenty of time on the wheel. We felt that Angus could have been a bit better at explaining things but overall were very happy with the class and with what we made!It was really great that we were able to leave our ceramics with Sari Api to dry and glaze. Following this process Sari Api sent them over (we paid AUD$50 for shipping). The shipment took a long time but it was worth it. We would recommend Sari Api for on the wheel classes and we will definitely be returning. Thank you!,5.0 of 5 bubbles,"Written June 12, 2017"
1553,Sari_Api_Ceramic_Studio,"I emailed Suzan about wanting to work on the wheel and said I was happy to do either a group or private workshop. She wrote back saying there was a group workshop available a couple days later. I assumed that it would be sort of tailored to everyone's interest. It was more generic -- we did two hours hand building and 45 minutes on the wheel, which is okay as I was open enough to doing some hand building. Agus was nice and clearly a very talented potter but the class had a serious tone to it, and was perhaps a bit boring if you have done pottery before. So overall the workshop was okay, not great, but not bad either.The main disappointment I felt was that we were told our pieces would be ready in roughly three weeks, but when I called the studio after 3 weeks Agus said there hadn't been enough business to even do a first firing as they were waiting for more pieces so it would be a further 3 weeks. I am leaving in a week so he offered to ship them to Ireland for 50 dollars (!!!) which is as much as the workshop itself. I understand circumstances change but they easily could have emailed me about this. The glazing and firing are included in the workshop price, so it seems to me their responsibility to contact people if they are not going to do it. I've done plenty of other pottery workshops in Oz, Canada and Ireland and they have been cheaper, more fun and you get to keep your trinkets!",3.0 of 5 bubbles,"Written March 17, 2017"
1554,Sari_Api_Ceramic_Studio,"For those interested in working with clay, whether with experience or as a novice, Sari Api provides all one could wish for. Agus and Suzan instruct first time potters of all ages in various techniques in the well-equipped studio with patience and enthusiasm so that even those booking in for a three hour session produce a piece to be proud of. I spent ten marvellous open studio days at Sari Api re-engaging with clay after a break of thirty years. Suzan's open studio arrangement allowed me to set my own hours and work at my own pace, experimenting as I pleased with clay, slips and glazes.   The tranquil, unhurried atmosphere in the  airy  studio is perfect for anyone seeking time away from Bali's tourist hustle and bustle.   For me, it was the perfect ceramics sabbatical.",5.0 of 5 bubbles,"Written July 26, 2016"
1555,Sari_Api_Ceramic_Studio,Saturday Kids ClassesWe have been going do close to 4 years now and what can I say it's fantastic. Both Suzann and Agus are great with kids and have such talent.Classes are 10:30am to 12pm every Saturday. You will meet people from all walks of life and your kids will just love it.Located approx 3.5km down Jalan Suweta on the left. Not far from central Ubud.Both new and regulars come and are not disappointed at all.,5.0 of 5 bubbles,"Written April 10, 2016"
1556,Sari_Api_Ceramic_Studio,"My daughter has been going to Sari Api for years....she absolutely loves it! It's a great place to go and let your creative juices flow! The only problem for tourists traveling here, is that it takes time for your pieces to get fired in the kiln. Perfect for families visiting for a longer stay or people who live here!! Ibu Suzan and her staff are amazing!!",5.0 of 5 bubbles,"Written February 9, 2016"
1557,Sari_Api_Ceramic_Studio,I surprised my girlfriend and booked us a half day class which was very intimate as it was only the two of us and our teacher Agus. We had a very enjoyable day and found it very educational and with a bit of guidance we made some nice ceramics. Our items were packed very well in bubble wrapped and shipped to us.,5.0 of 5 bubbles,"Written January 16, 2016"
1558,Sari_Api_Ceramic_Studio,"The place was a bit messy but it is to be expected from a ceramic studio. The staff was quite helpful and patient. We did make a reservation for two well before we came, so everything was seamless. Agus promised to deliver our artworks and he was true to his word. It will take sometime for him to finish the glazing and all, but our things was well packaged so none of them was damaged.",5.0 of 5 bubbles,"Written May 5, 2015"
1559,Sari_Api_Ceramic_Studio,"we attended the Saturday morning session for kids which my son loved. we understand it was a particularly busy day so I guess that explains why it felt a little disorganised. suzan was fantastic and although the assistants tried to help their english was very limited compared to most in central ubud. we didnt realise it would take 3 weeks to fire the pottery so we had to take it back to our hotel wet to sun dry. we also thought our son would get a turn on the potters wheel but apparently only 15 people can do so and they're selected randomly. disappointing for a 5yr old whose super excited to try it. no huge problem, just feel these things should be explained in the leaflet or when we contacted by email earlier in the week. a minor thing but we never got the hibiscus lemonade thats promised either.all that said, my son loved it and it was great to do something creative with him whilst on holiday. I quite fancied doing an adult class myself.",5.0 of 5 bubbles,"Written February 18, 2015"
1560,Sari_Api_Ceramic_Studio,"It was a really fun and relaxing morning. We were all trying it for the first time and we all enjoyed it, even my husband who was just looking on. We will be back for more!  The place was easy to find, we went by taxi and returned to central Ubud walking, all down hill. Suzan is a lovely person, and very clear about prices and details and about letting you know the pieces you make will not be ready instantly. She will keep them for you or have them shipped at an extra cost.  If you have never tried ceramics, this is a perfect place to start.",5.0 of 5 bubbles,"Written December 25, 2014"
1561,Sari_Api_Ceramic_Studio,"The class that my boyfriend and I did with Suzanne in December this year was the best thing that we did while in Ubud.Our three hour class was run out of Suzanne's studio, behind her home in a small village about 15-20 minutes just outside of Ubud (an approx AUD$7 taxi).Neither of us have any experience working with ceramics, but Suzanne guided us through making vases using slabs of clay, and then bowls and plates on a wheel.Suzanne is also a very interesting woman and we had a great time chatting to her throughout the class.I would highly recommend this experience!",2.0 of 5 bubbles,"Written October 26, 2014"
1562,Sari_Api_Ceramic_Studio,"My husband and I went to Sari Api while on our honeymoon. It was such an awesome creative outlet and a welcome change from our more touristy endeavors. The studio is a little off-the-beaten path, and the ride there through rice paddies was lovely. It was such a tranquil setting - the perfect place to learn this calming and meditative art form. Ubud is overflowing with art and creativity, it's the perfect place to make on your own, even if you're not an artist. Suzan and her team were so helpful and patient, and we can't wait to go back if we're ever in Bali!",4.0 of 5 bubbles,"Written December 7, 2012"
1563,Sari_Api_Ceramic_Studio,"Girlfriend and I attended a class. I had never done pottery, so the guy was teaching me all about it. On the other hand my gf is quite competent and received little advice/help since the guy could see she knew what she was doing. At the end he says it's $80 (aus) (whatever that is in rupee, I'm from aus and everything was marketed towards australians/tourists), I try to reason that it was advertised as $40 for a beginner class, and $10 for a free session if you know what you're doing and don't need help. So $50 right? Nope, he won't take any of it, despite him barely talking to my gf.Anyway I'm not too fussed, it was near the end of our holiday and we were somehow under our budget so ok. Also he said he would post our works to us once they were fired so we left our addresses, and emails (we would have to pay for postage, he said once they were ready to be posted he would email us and we could pay with bpay or something, no problem, I thought my bowl was sick and just wanted to use it!).That was three months ago, since then I've sent them two emails, called numerous times but they rarely answer the phone. On two occassions they picked up, asked for my email and promised they would be in contact asap. Neither of us have received an email.I advise you find a better place for pottery because these guys are a joke. Their prices are just ridiculous too. Last week I attended a pottery class here in downtown Sydney, it was half the price for the same thing. How these guys in the back of Ubud can be more expensive is beyond me...",3.0 of 5 bubbles,"Written January 12, 2012"
1564,Sari_Api_Ceramic_Studio,"I had only been doing pottery for a few months when I went along to Suzans class so I was a complete novice having worked with limited materials and tools and never having used the wheel (I had only hand built) however doing a class with Suzan was one of my top holiday experiences for this trip- I loved it. Suzan really is a wonderful teacher- she explained everything clearly and was more than patient and very encouraging.  Suzan is a lovely woman- she has lived in Ubud for 15 years and is really interesting and very well humoured, she made this experience great for me- I was intimidated by 'the wheel' prior to doing her class. The setting is lovely, only 3-4kms from the town centre in a nice cool workshop set amoungst a nice green garden. Due to limited time in Ubud we only did a half day class (3 hours = 350,000Rp, inclusive of materials, clay, glazes etc) and she is posting our work back to Australia for us for a reasonable rate- If you have ever wanted to try pottery please contact Suzan- her class is a wonderful introduction to pottery for the novice and a great experience for the more seasoned potter :-)",5.0 of 5 bubbles,"Written December 9, 2011"
1565,Sari_Api_Ceramic_Studio,"Took the full course with Suzan and can't say enough good things about her and the class. I was a complete novice but she had be turning out amazing things and having a great time doing it. Great teacher, amazing studio with inspiration in every nook and high quality materials. A perfect thing to try your hand at while on holiday.",5.0 of 5 bubbles,"Written October 10, 2011"
1566,Supermarket_Bintang,"Came to buy some fresh vegetable, and we found they also sell a bali souvenir with sale price, its a good choice if you confused to find a souvenir as gift for family, lot's of sale and promotion",5.0 of 5 bubbles,"Written September 1, 2021"
1567,Supermarket_Bintang,You have the right to return an item that is not what is advertised and expect polite service . Yesterday i was accused of buying and item elsewhere and returning it to Bintang when i was standing there with the receipt I was made to feel a liar when it was obviously the item was bought from Bintang. I had no problem with it being exchanged for the correct item which eventually they didn’t have but no the manager couldn’t just say sorry for the inconvenience and sort it out without a belittling condescending accusing attitude . Bintang you are here to the service public and in these difficult times as now you certainly have time for management training to treat the customer with respect,2.0 of 5 bubbles,"Written January 2, 2021"
1568,Supermarket_Bintang,"There are two Bintang in Bali,one is located in seminyak,another in ubud.i vsited Bintang ubud one time,but it is many years ago,last year when i stayed around here,i visited here twice.it is a big supermarket in ubud,you can find food, groceries, drinks, souvenirs, snacks,etc. i purchased many soaps,for myself also for my family,and also some snacks,like peanuts,biscuits,chips,and also packs of green bean drinks. very nice shopping experience. price here is reasonable. do bring your own bag while shopping.",5.0 of 5 bubbles,"Written May 31, 2020"
1569,Supermarket_Bintang,"This supermarket got everything I need to fixed our lunch and dinners. They have a lot of selection of meat and seafood. Good varieties of fresh fruits and vegetables also. One thing I loved is they have a lot of souvenir items you can buy without going to the flea market and try to bargain. Here, prices are pretty much comparable to the market price. Cashiers are very helpful and friendly. Make sure you bring your own eco bag if you are shopping in Bali. Plastic bags are thing in the past. They are serious in saving the environment. I went to the Bentang supermarket in Ubud and brought my own eco bag.",5.0 of 5 bubbles,"Written March 24, 2020"
1570,Supermarket_Bintang,"The Bintang supermarket we normally use burnt down so they are running a pop up size shop at the moment while they rebuild which is sad. I wanted to buy some items so i went to their facebook page to ask if they had the items in stock as they were more of a gift line not a necessity, i was told only in the Ubud store but if i wanted to order they would bring the stock down to the pop up shop for me, so i placed my order and said i was flying out the next morning and asked what time could i pick the items up only to be told they would deliver the items to me free of charge, you could not ask for better sevice. So PLEASE support these guys as they go way beyond what anyone esle would to to make you happy.",5.0 of 5 bubbles,"Written February 19, 2020"
1571,Supermarket_Bintang,"Hopefully a rebuild. Once a bustling favourite among tourists, the Bintang Supermarket (Bintang means Star) burnt down in the early hours of the morning on Thursday 16th January 2020. There is talk that it will be rebuilt, but that will be some time away. I purchased some chocolate and a couple of music instruments, then later that night a very hot fire ripped through the place. Quite a number of people filmed the event.",4.0 of 5 bubbles,"Written February 2, 2020"
1572,Supermarket_Bintang,We walked from Lippo Mall to Bintang and back (12km) one day before the massive fire. So happy to have gone as we always do when in Kuta. So sad to hear the news the next day. Hope a rebuild happens for our next visit.,4.0 of 5 bubbles,"Written January 23, 2020"
1573,Supermarket_Bintang,Highly recommended!!! I can’t leave this place in 1.5 hours. There have so many things that you can buy and it is slightly cheaper than other stores. It also have so many coffee beans that you can check it out .  Coffee lover must come !!!,5.0 of 5 bubbles,"Written January 14, 2020"
