place,location,content,rating_num,dates
canggu,Canggu_Scooter_Lessons,"Great instructor, Gede was so patient and helpful to teach me step-by-step all about how to drive the scooter. Most important is to learn and to understand the rules and to take is slowly. We practiced many different situations to get the confidence on the street and it really helped me. I can recommend to take lessons first before jumping straight on your bike. It’s great fun and you learn important details rather than by expensive mistakes. Thank you - Terima kasih to Gede and to the school 🙏🏼🤙🏽🛵",5,2021-09-10
canggu,Canggu_Scooter_Lessons,"Definitely the best team ever. I appreciate their patience, kindness, their help throughout the whole process. They helped me boost my confidence as the traffic can be quite overwhelming at times. They really make you feel comfortable and will make sure to teach you the right way and understand how to deal with the traffic here. Terima Kasih Banyak to the whole team. 🙏🏽",5,2021-08-09
canggu,Canggu_Scooter_Lessons,"The best service. Gede was so patient and make it look so easy, he made me feel confident and comfortable, giving simple and accurate directions. Within a few hours I was already driving at the street even it was my first time riding a scooter!! 100% recommended",5,2021-07-14
canggu,Canggu_Scooter_Lessons,"I was a complete beginner and nervous but Gede inspired confidence in me. I enjoyed learning about how the scooter operated  and within 5 minutes I was riding around on my own. I loved it and when I return to Bali I will have a few more lessons before hiring my own scooter. A fabulous experience, thanks",5,2021-07-03
canggu,Canggu_Scooter_Lessons,Amazing. Highly recommend to take scooter lessons with them. ❤️ I learned to drive a scooter in 3 hours.,5,2021-06-24
canggu,Canggu_Scooter_Lessons,"Yogi was my instructor today, within two hours he was able to delivery a thorough understanding of road Lenin Bali as well as help me feel more confident riding a scooter. I can’t recommend Canggu Scooter Lessons more!!! Excellent!! Thank you Yogi!🙏🏼🙏🏼🙏🏼",5,2021-06-22
canggu,Canggu_Scooter_Lessons,"Helpful, reliable and with a lot of patience. 100% recommend if you need some help to feel secure on a scooter in Bali.",5,2021-04-16
canggu,Canggu_Scooter_Lessons,"If youre in Bali and wanted to learn how to drive a scooter, Canggu Scooter Lessons is the place to be. Gede was my instructor and he’s good, now Im driving around Bali.",5,2021-03-03
canggu,Canggu_Scooter_Lessons,"Krisna and his team at Canggu Scooter Lessons are amazing! I was nervous about learning how to ride and riding on the roads of Bali, but after just one 2 hour lesson, I was confident and ready to ride. The instructors are patient, kind, extremely thorough with perfect English. They take your time to make sure that you are comfortable, and give you all the information you need to ride on the roads of Bali. The team is also very helpful in getting your license in Bali. They provided a fast and personal service without any hassle. If you are looking to learn to ride regularly, or just for fun, definitely give them a call!",5,2021-01-05
canggu,Canggu_Scooter_Lessons,"Gede its very nice instructor high recomended to have class with himSimple lesson, completely easy to understand",5,2021-01-05
canggu,Canggu_Scooter_Lessons,"Gede teach me riding so well, i learn so fast because of him.i cam go wherever i want right now, thankyou xo much gede.",5,2021-01-03
canggu,Canggu_Scooter_Lessons,Had a great experience with gede as my trainer He is very friendly and helpful and very patient when he teached me to ride a motorbike and made me more confident to increase my speedThank you gede and all canggu scooter lessons teamWould highly recomend this to all of my friends!!,5,2020-11-25
canggu,Canggu_Scooter_Lessons,"Oh my gosh, I am so grateful to Krisna foe giving me freedom to zip around Bali! He is the best teacher! patient, relaxed, and gave me so much confidence to progress quickly on to the road, highway (sunset road!) or the shortcuts. Taking lessons with Krisna is a must to avoid accidents and learn local rules, tips and tricks for navigating seemingly chaotic traffic of Bali. Thank you!!🙏🏼✨",5,2020-11-08
canggu,Canggu_Scooter_Lessons,"All I can say is: I wish I booked the lesson earlier! Just three weeks ago I didn't even know how to ride a bicycle. Now I ride a scooter everyday. Imagine, I had no idea what balance was. Struggling but not for long. On first day, the instructors brought me a bicycle to start with. To have the understanding of balance. After 20 minutes we tried the scooter right away. It took 6 times lessons in total. The last 2 lessons we did it on the road.The instructors gave not only good instructions about how to ride, but also safety on the road and most importantly gave you confidence too. Thank you so much Krisna and Gede!For anyone who wants to learn motorbike or just want to gain confidence on the road, give it a go!It is value for money too. I highly recommend it👌👍",5,2020-07-11
canggu,Canggu_Scooter_Lessons,"We became much more confident on the road thanks to these great guys. They are good,patient teachers and very nice people. If you are scared of driving or need to get some skill,take a lesson with them.",4,2020-01-23
canggu,Pravilo_Bali,"From curiosity into knowledgeable of what pravilo gave me, its more beneficial than I could ever imagine. a genuine personal training which lead my goal in and out of my physical and mental into better shape, a soft stretching based on our own strength and release lots of tension, I was on journey to calm and peaceful destination, this is again a life changing experience and can’t wait to reach the next level. My deepest thank you and respect of what they did create. highly recommend!!",5,2020-01-08
canggu,Nirvana_Strength_Bali,"Will and Norman have taught me how to handstand and splits, which were impossible movements for me before. Now I’m so strong and so confident, I feel like it’s a new world, hope I can keep learning and improving when I’m in Bali next time!!",5,2021-12-27
canggu,Nirvana_Strength_Bali,Love the classes and the community they have built all very welcoming and really learn how to move and strengthen your body properly for longevity,5,2021-12-20
canggu,Nirvana_Strength_Bali,A big community of positive growth physically and mentally. Like a second home for those who love to train and learn.,5,2021-12-13
canggu,Nirvana_Strength_Bali,"Good vibes, good food, good classes with nerdy (in a good way!) approach. Now i know what's scapula traction and hip supination! Or something like that...Norman, Will, Ian - you guys are epic!",5,2021-12-09
canggu,Nirvana_Strength_Bali,Amazing space with world class instructors.  This is a unique space in Bali which has a huge strength training centre beautiful rice paddy with infinite view 'back yard' which is a deluxe space for movement meditation and yoga.  They have surf strength 🌊 classes - recovery for injury - good sized sauna - hot and ice pool - amazing equipment and genuinely super skilled teachings from professionals that you won't find in any other gym or health space here.  There's also the podium cafe with fresh juice and healthy varied food and energy boosting snacks.  The staff are super amazing and so kind happy and welcoming. ✨ They also have social events in the 'back yard' don't miss this unique healthy and wonderful opportunity to recharge work intelligently with your body and detox ( or grab a beer 🍺 at Comedy night) Thanks @Nirvana you are ace 💚,5,2021-12-04
canggu,Nirvana_Strength_Bali,One of the best gyms in the world 🤟🏻  Definitely would recommend joining all the classes. Great atmosphere and friendly staff 🤍,5,2021-12-02
canggu,Nirvana_Strength_Bali,"Hey surfers,You should definitely check this gym out! If you passionate about surfing or especially if you professional surf athlete. This place is offering smart and intelligent approach to training. If you interested in your surfing longevity or simply wish to eliminate shoulder, neck and lower back aches there are well thought preHab classes for you. As well as surf specific classes for beginners and intermediate surfers who wish to start surfing in most safe and efficient way or boost their performance on the wave by learning the correct technique. This is the only place in Canggu offering such an amazing training and recovery  options for surfers!",5,2021-12-02
canggu,Nirvana_Strength_Bali,"Ive been surfing for nearly a year now, mixture of self explorations, a few surf classes in the sea and recently I’ve joined some of Elena’s surf technique classes at Nirvana. Elena’s classes have always provided some inspiration of something to play/ work with in the sea. For example not moving the head whilst standing, feet sensitivity training, body rolls. Personally awareness cues transforms an experience be it surfing, yoga or handstands or many other things! So go experience Elena’s class .. if you are a beginner or experienced awareness cues can assist anyone. Training on land gives spaces to go into details which which can be put into play in the sea. 🏄🏻‍♀️ Surfing is one of the absolute joys of Indonesia.",5,2021-11-30
canggu,Nirvana_Strength_Bali,"Great community and classes, the coaches are very professional. We live in Nusa Dua, we travel 1+ hour to be able to train here. Recommended! ⭐️⭐️⭐️⭐️⭐️",5,2021-11-26
canggu,Nirvana_Strength_Bali,"I've just being 3 days coming, and purchased the gold membership which is so far way with it, yoga classes in the morning by Douglass have been epic, he is so knowledgeable and really entertaing and warm coach.I've tried the splits classes and one leg squats from  Norman, they have been a total new experienc, hard in a fun and super exciting way.The strength and conditioning class (forgot the coach name, she is a lady from Jakarta) was great too, just overall really knowledgeable, and professional coaches with heaps of experience.The recovery area has everything I expected, and it is so far never too busy.The community seems very cool, friendly and kind without the crazy chit chat from other gyms, like a little more.mature crowd that's been on the island for a while.Food at the cafe and coffee is very good and prices are fair with no added tax or service surprises, and they are giving out free coffee or juice with the lunch which was a great surprise. When It comes to reception staff, they are a 10/10 all the girls are extremely profesional and realy on top of things,  always coming up with the offers at the cafe, and remembering your name from day one.",5,2021-11-23
canggu,Nirvana_Strength_Bali,This place is a must try!! The gym facilities are great and the spa is also one of the best in Bali. The classes are beginner friendly but also challenging for intermediate/advanced athletes. It’s also a great place to hangout and meet people :),5,2021-11-15
canggu,Nirvana_Strength_Bali,"Trainers are amazing and the people are very friendly. If you've any fitness goals, this is the place to train and achieve them. When you're there meet Lala, she will sort you out with everything if you're new in Bali.",5,2021-10-25
canggu,Nirvana_Strength_Bali,Great place for functional training and calisthenics! The community makes you want to always be growing. I’ve been training here for a while now and I can testify to the improvement I have seen in myself.,5,2021-10-18
canggu,Nirvana_Strength_Bali,"Nirvana Strength is one of the best gyms I've ever trained in! I love that it focuses on functional training, and all of the classes are geared to helping students be more mobile, flexible, and strong in our daily lives, as well as in our other athletic activities. I mainly do Muay Thai and rock climbing, and I've found huge improvements in my abilities in these two sports over the last couple of months. The coaches are top-notch - patient, knowledgeable, and professional - and the community is wonderful. Everyone makes you feel welcome, even if you are a beginner with no gymnastics / mobility-training background. Lovely place, and I'd highly recommend it to anyone who wants to learn new skills and is looking for a different gym experience.",5,2020-02-17
canggu,Nirvana_Strength_Bali,"This place has it all. The staff are wonderful and always greet you with a smile. The fitness instructors are highly knowledgeable and professional in their fields and truly help you to the best of their ability to reach your fitness goals and get to where you want to be. They cater to all levels, abilities and athletes with varied backgrounds. Weather your a surfer, Yogi, footballer or Dancer this space has the equipment and tools for you to reach your potential. Classes are immersive, challenging and educational. The Capoeira  Magnificent B.T.W the adjoining restaurant has the tastiest grub going and the portions are HUGE, try the pancakes, they are daddy size and or the mouthwatering Omelette, which is so creamy and light while at the same time filling! I don't know how the chefs do it, but it keeps me coming back for more! A1 spot.",5,2020-01-27
canggu,Pranava_Yoga,"This place is very very beautiful and peaceful and all the people very kind and friendly but one of the teachers there is the reason to visit Pranava yoga 100% when in Bali.The Dancing warrior a.k.a. Diaz is the most unique yoga instructor i have ever met in my life. After just the first time i joined his class i couldn't but most importantly i didn't want to practise with anyone else. His voice, his creativity, his vibes, his words and what i felt during and after his class are one in a lifetime experience!!",5,2021-09-10
canggu,Pranava_Yoga,"Hello everybody! I’m so impressed of pranava yoga! Ive already practiced yoga for 2 years, but never had such experience. Vinyasa flow is my favorite, highly recommend! And the place is also unbelievable, vibe, location, colors are just perfect.",5,2020-02-25
canggu,Pranava_Yoga,"Vinyasa classes are the best! Specially with Diaz! His energy+techniques create one of the best Yoga experiences ever!  Besides it the studio is big, open, fresh and relaxing! My favorite yoga spot in Canggu.",5,2020-01-13
canggu,Pranava_Yoga,"Beautiful setting. The studio is open air surrounded by a tropical garden on one side and a terraced rice field on the other.  A Balinese woman renews and blesses the alter with flowers, prayers and incense every morning.  The teachers are friendly and give expert instruction.  I felt challenged and supported.",5,2020-01-09
canggu,Pranava_Yoga,"Loved the space, its open and airy. Classes very diverse in terms of posses and difficulty level. Had anti gravity yoga and vinyasa both by Mano and Diaz went both classes multiple times.Xx Inara",5,2020-01-08
canggu,Solace_Float,"I do love the sensatiob when floating. It was so calming especially with the relaxation music. Beside that, the hospitality was great and the place was clean.",5,2022-01-03
canggu,Solace_Float,"After the treatment I got little bit sore on my shoulder.I just told by the staff that I need to be super relax when floating, I didn’t realise it that I’m not relax enough, kinda regret it.Overall all good, I love the vibe, blue and calming.Will try it again.",5,2022-01-02
canggu,Solace_Float,I found this method has the best way to relax me in every way possible from the welcoming the aromatherapy the music and of course the floating.,5,2022-01-02
canggu,Solace_Float,I had the most amazing experience. Relaxing is really hard for me. I have PTSD and anxiety so when I learned of the benefits I was excited to try! The first 30 minutes my mind wondered to the most randomest things. Which I heard was normal the first couple of times. I wasn't expecting to be able to be able to empty my mind at all the first time. Eventually everything went blank unless I touched a wall by accident then my mind wondered again for like 10 minutes before going blank. I fell asleep the last bit of it which I heard was good. That night I had some of the recognizably best sleep of my life. I'll definitely be adding this to my routine self-care routine. Cant wait to go again to see if I can clear my mind sooner.,5,2022-01-02
canggu,Solace_Float,Trying for the first time and it was awesome relaxation and definitely recommended for you if you look for something different in Bali 😊,5,2021-12-18
canggu,Solace_Float,"I’m was got a amazing relaxation. Sejenak ketenangan yang di cari di dapatkan. Can’t wait to go back 🥰. Aroma terapi, music, tea are so amazing…",5,2021-11-28
canggu,Solace_Float,"The most unique experience. Float makes me calm, love the tea ceremony! Beautiful place to visit in Canggu!",5,2021-11-19
canggu,Solace_Float,Everything was great. I enjoyed mostly the pillow under the neck supporting it. Other float tanks don't have this often.,5,2021-07-30
canggu,Solace_Float,They treat you like royalty here. Love the ambient vibe and very good facilities. Thanks for a wonderful experience I will be back.,5,2021-06-24
canggu,Solace_Float,"Thank you very much for the great experience at Solace Float. I could recommend it to anyone looking to relax and reduce stress. Thank you also to staff who are very professional and pleasant, which makes your experience even nicer. I will be back often!",4,2021-06-08
canggu,Solace_Float,"I just had my first float experience and loved it. A few minutes for my mind to peace. I’m sure I hadn’t fall asleep, where had the hour gone? Sooo relaxing, I’m so glad that I tried it ♥️",5,2021-05-26
canggu,Solace_Float,This is my first time floating and I like it especially the part when I turn the light off it feels really nice and relaxing🥰.,5,2021-04-04
canggu,Solace_Float,"Solace is awesome! Really good float deals being 90 minutes compared to other places for only an hour. The ambience and staff were great. Cool how you can select your own music, be in complete control of volume, lighting, pod door open or closed, etc. Very comforting. First time floating and I will definitely be back!",5,2021-03-01
canggu,Solace_Float,"i really enjoy this float experience, for sure i will be back to my 2nd float and make it as my regular self care routine",5,2021-02-19
canggu,Solace_Float,"It’s an experience that I wish everybody could try, it feels like if our body was floating without gravity, completely weightless , a sensation that I’ve only felt in my dreams when dreaming of flying. It’s extremely relaxing and it has a spark of magic. One particular note on the music, really really good! I can feel that is very well and deeply thought and organised , it played a huge role in my floating. I will go back often!",5,2021-02-18
canggu,Solace_Float,"So worth to try! I felt amazing after the session!My body and mind recharged, rejuvenated, concentration improved, all in all I felt calm and uplifted!It’s like a meditation pod. I love it!",5,2021-02-12
canggu,Solace_Float,"This was my first time floating and I really liked the experience. The place is very nice… you could probably describe it as a mix of feng shui and futuristic ;) everything is brand new and super clean. I actually wanted to try floating therapy for some time as I heard many good things about it and wasn’T disappointed. The 90min flew by while I was in the tank and I came out super relaxed, really recommend to try it!",5,2021-02-08
canggu,Solace_Float,"I never did floating therapy before, heard many good things about it though but wasn’t sure what to expect... LOVED IT!Been stressed out all week as we just moved to a new house, had trouble to calm down and even to sleep at night - floating at Solace was exactly what I needed to get back on track and to finally let go of the tension! Slept like a baby afterwards 😉",5,2021-02-04
canggu,Solace_Float,"It was my first float experience and all my expectaions were exceeded.Nestled in the bustle of Canggu, when I arrived at Solace I felt transported to a world of tranquility. I felt instantly more relaxed and centred.The facility is world class, clean and comfortable. The staff are friendly and knowledeable, any uncertainty I had was quickly forgotten. I felt welcomed and comfortable from the time I arrived until I left.The float itself was spectacular, but I was most impressed by the attention to detail and the balance of professionalism and tranquility. I left feeling relaxed and peaceful and my expectations were exceeded.I definitely reccommend it!",5,2021-02-01
canggu,Solace_Float,"This was my first experience and I was scared to be honest, because I can’t swim and I have very bad experience with water in general. I wasn’t sure that it’s for me but once I got to Solace and the girls showed me everything and explained the process I was ready to try. There is no chance to drawn and I was calm. The 60 min floating was about reflecting on myself and observing my mind being hectic. I let it be and sometimes had fun with feeling how my body moves slowly in the water. I should mention the place itself is amazing! Everything is made to slow down, chill and have great experience. Shower, body lotions, chill zone after floating, tea. You can even play chess if you feel like. Thank you guys for having us!",5,2021-01-23
canggu,Solace_Float,"My experience at Solace Float was top notch and I would recommend it to anyone who wants to simply let go and relax fully. From the moment I entered the spa, I felt so welcomed and at ease. The staff were absolutely lovely, super smiley and sweet. It was my first experience doing a float so I was a bit unsure what to expect. The staff answered all of my questions thoroughly and made me feel comfortable from start to finish. The float was like a dream. I was able to completely relax and let my mind go blank. There were no sensations, with no distractions from my deep meditation. The post-float 'flow' was so lovely. You take a shower (loved their soaps and lotions) and finish with a complimentary tea ceremony. I wouldn't change a thing about my experience and have since recommended this spa to several friends. Definitely give it a try! You won't regret it.",5,2021-01-17
canggu,Solace_Float,first time ever did the floating experience & it turned out so gooddd. all the facilities are totally complete!,5,2021-01-14
canggu,Pravilo_Bali,"From curiosity into knowledgeable of what pravilo gave me, its more beneficial than I could ever imagine. a genuine personal training which lead my goal in and out of my physical and mental into better shape, a soft stretching based on our own strength and release lots of tension, I was on journey to calm and peaceful destination, this is again a life changing experience and can’t wait to reach the next level. My deepest thank you and respect of what they did create. highly recommend!!",5,2020-01-08
canggu,Nirvana_Strength_Bali,"Will and Norman have taught me how to handstand and splits, which were impossible movements for me before. Now I’m so strong and so confident, I feel like it’s a new world, hope I can keep learning and improving when I’m in Bali next time!!",5,2021-12-27
canggu,Nirvana_Strength_Bali,Love the classes and the community they have built all very welcoming and really learn how to move and strengthen your body properly for longevity,5,2021-12-20
canggu,Nirvana_Strength_Bali,A big community of positive growth physically and mentally. Like a second home for those who love to train and learn.,5,2021-12-13
canggu,Nirvana_Strength_Bali,"Good vibes, good food, good classes with nerdy (in a good way!) approach. Now i know what's scapula traction and hip supination! Or something like that...Norman, Will, Ian - you guys are epic!",5,2021-12-09
canggu,Nirvana_Strength_Bali,Amazing space with world class instructors.  This is a unique space in Bali which has a huge strength training centre beautiful rice paddy with infinite view 'back yard' which is a deluxe space for movement meditation and yoga.  They have surf strength 🌊 classes - recovery for injury - good sized sauna - hot and ice pool - amazing equipment and genuinely super skilled teachings from professionals that you won't find in any other gym or health space here.  There's also the podium cafe with fresh juice and healthy varied food and energy boosting snacks.  The staff are super amazing and so kind happy and welcoming. ✨ They also have social events in the 'back yard' don't miss this unique healthy and wonderful opportunity to recharge work intelligently with your body and detox ( or grab a beer 🍺 at Comedy night) Thanks @Nirvana you are ace 💚,5,2021-12-04
canggu,Nirvana_Strength_Bali,One of the best gyms in the world 🤟🏻  Definitely would recommend joining all the classes. Great atmosphere and friendly staff 🤍,5,2021-12-02
canggu,Nirvana_Strength_Bali,"Hey surfers,You should definitely check this gym out! If you passionate about surfing or especially if you professional surf athlete. This place is offering smart and intelligent approach to training. If you interested in your surfing longevity or simply wish to eliminate shoulder, neck and lower back aches there are well thought preHab classes for you. As well as surf specific classes for beginners and intermediate surfers who wish to start surfing in most safe and efficient way or boost their performance on the wave by learning the correct technique. This is the only place in Canggu offering such an amazing training and recovery  options for surfers!",5,2021-12-02
