place,location,content,rating_num,dates
kuta,Waterbom_Bali,"This was unexpectedly so much fun and a really great way to spend a day with the family. We were with a 3 year old toddler, and there were still many options to keep us buys through the day. Highly recommended as an alternative activity whilst in Bali, for Kids and the Adults.",5,2021-12-30
kuta,Waterbom_Bali,"An enjoyable day with my family. Booked the tickets online through waterbom website, quite easy. The staff was friendly and well trained. One of the best water parks. Please remember that it is only open from Friday till Sunday",5,2021-12-30
kuta,Waterbom_Bali,A place of fun and joy! We really high recommend to visit waterbom. The staffs there were gorgeous. Can’t wait to ho there again.,4,2021-12-14
kuta,Waterbom_Bali,This is the place to make memorable experience.There are exciting waterslides and water games for all ages.And the best thing is the changing room  is clean,5,2021-12-14
kuta,Waterbom_Bali,"We came here multiple times but only now have I had the chance to leave something nice. Waterbom Kuta Bali is definitely one of the best waterparks in Indonesia. Service is wonderful, food is surprisingly nice overall too. The entrance tickets may seem a bit pricey but I’d say it is worth a whole day at the pool, plus they have lots of promotions going on. Hopefully they can survive this pandemic. Will come back soon with my kids!",5,2021-12-05
kuta,Waterbom_Bali,"We had a awesome day in Waterbom park. First, they give you a wrist band that you can charge and buy food, drinks, etc. in the park. If your wrist band is still charged when you leave. The rest of the money will be returned to you. It is a large water park with high water slides. One of the best parts is the lazy river that sleeps on the tube and the flow of water moves you in a green direction. There are a number of cafes and fast foods there. We used massage there, they were not professional but it is good for the park. Spend a full day at Waterbom,  it 's a lot of fun.",5,2021-09-18
kuta,Waterbom_Bali,Awesome day out for kids and grown ups alike. Rides are world class with plenty of safety staff. Facilities well maintained and clean. Pricey food as expected in any theme park but excellent quality. Definitely worth a visit - we will be coming back to play many times in the future.,5,2021-09-08
kuta,Waterbom_Bali,"In 2015, my family and I planned to go on vacation and my family decided to go on vacation to Bali. In Bali, there are many tourist attractions that can be visited. On that day, the weather was very hot so instead of buying an ice cream, we decided to went to waterbom bali.Waterbom Bali is located at Jalan Kartika Plaza, Kuta, Bali 80361, Indonesia. This water tourism object is perfect for you to spend your vacation with your family and closest friends. Even though there are so many tourist attractions you can visited, Waterbom Bali is a place that you must visit if you go to Bali.There are lots of facilities that we can enjoy in waterbom bali. There are storage lockers, a gazebo, a place to rent a place and there are many restaurants inside. In addition to the many facilities that we can enjoy, there are also many rides that we can play. Climax is one of the rides that we can play, this ride invites you to play in a small hallway with a height of 16 meters above the ground and is able to push you quickly using the flow of water. And also in Waterbom Bali, There are people who is a guards that will watch over us and reprimand us if we commit violations such as eating food while swimming or drinking while swimming.Also if you went to Waterbom Bali, I suggest you to look at the map and remember the rute because I once had lost and get separeted with my cousins inside of Waterbom Bali. That’s all for my review for Waterbom Bali, I really hope you guys can atleast once go to waterbom bali because it is really fun.",5,2021-09-02
kuta,Waterbom_Bali,"Waterbom Bali is a place to have fun with water. Located in kuta area, waterbom will give so much pleasure all day fun with family and friends. It was built in 3.8 hectar and it has more than 20 waterslides, makes waterbom bali is one of the biggest waterpark in south east asia.The staffs are friendly and helpful. The place is well maintained, clean and safety conscious. some of the good water ride that you should try such as funtastic, smash down, phyton, pipeline, and for sure lazy river. The price is reasonable since you can be in the waterbom bali for whole day. The food is also good and there is an icecream. Over all, waterbom bali is a good place to play with water with family and friends. Enjoy!",5,2021-08-12
kuta,Waterbom_Bali,THIS WAS AWESOME FUN!We had the best time at Waterbom it was very quiet so we didn't have to wait for any queues we pretty had the whole place to ourselves. The facilities are good and the staff really went out of their way to help us have a fantastic time but take lots of sun screen because you are having so much fun it washes off quick and you do forget to apply more on.Other tan that is was SUPER FUN.Really highly recommended a must do in Bali,5,2021-08-05
kuta,Waterbom_Bali,"Cleanliness been amazing, well organized. The surfing course is way too expensive need adjustment in some way to lower the price, variety of attraction Is all fun, pool guard been very helpful finding us an empty pool chair. Changing room locker room shower room are well cleaned",5,2021-07-19
kuta,Waterbom_Bali,"I came with my husband and my 4yo son. We enjoy our time here. My husband said our visit to Waterbom Bali was the highlight of our 3weeks stay in Bali! So many slides, great food n bevs, my son was having so much fun too! Definitely would recommend everyone to spend 1 day of your holiday in Bali to visit Waterbom",5,2021-07-01
kuta,Waterbom_Bali,"one of the best waterparks I've been to in Indonesia and will always be my favorite waterpark.  Starting from the service to the facilities offered are very diverse.  Moreover, the slides they have are also very unique, different, and thrilling that you won't find in other waterparks",5,2021-06-15
kuta,Waterbom_Bali,"We went there with a group of friends of all ages (26-64) and enjoyed not only the fantastic slides and rides in and through the water but also the food, the swimmingpool bar and everything else. Great day! And with the special price it was twice as much fun.",5,2021-06-09
kuta,Waterbom_Bali,Good place to refreshing after tired off work. But i think the value off price for food little bit expensive :) that’s my opinion. Thankyou.,4,2021-06-09
kuta,Waterbom_Bali,"Food expensive and small portions. Need to have refills for water, less plastic in the world. I don’t think I’ll comeback.",5,2021-05-27
kuta,Waterbom_Bali,"This is such an amazing Waterpark. So well designed, so clean, incredible staff, very well priced. We will go back again and again.",5,2021-05-25
kuta,Waterbom_Bali,"staff and  service is good,  the place is nice and shade. Many game and amazing . This Waterboom is the best in Indonesia . but  fried rice is not pleasant on restourant. the other was all nice.if you come to Bali, you should be visit there.",4,2021-05-22
kuta,Waterbom_Bali,This place was awesome. Really more beautiful and fun than I expected. Plenty for all levels of adventure enthusiasts.,5,2021-05-13
kuta,Waterbom_Bali,"Waterbom Bali is a world-class water park with excellent rides, good food and bales with safes that make a convenient base when visiting with a group. Fun for kids and adults!!",5,2021-05-10
kuta,Waterbom_Bali,We had an amazing time with much fun on all the slides at waterbom. This is a must visit for all ages when visiting bali.,5,2021-05-06
kuta,Waterbom_Bali,The Easter package was really attractive and we didn’t have to wait much for attractions.We spend a really nice day and will be back for sure.Thanks a lot Waterboom Bali,5,2021-05-03
kuta,Waterbom_Bali,Awesome place. We ent with our 8 year old daughter and had a great time. Once bonus of covid times is that it wasn't that busy. I think it would be a different experience otherwise. We had a great time and would definitely go again.,5,2021-05-02
kuta,Waterbom_Bali,Ive been here when i was little and back again now with my husband.. it was so fun esp nowadays not so many people but they do their services at its best.. thank you Waterbom Bali..,5,2021-04-30
kuta,Waterbom_Bali,"First time going back since Covid started. The whole team there is fully prepared and following the health protocol perfectly.That being said I'm amazed with the level of quality of the park. The rides are amazing. You have a bit for everyone. you can come spend the whole day there with family or group of friend or both.The staff is so amazing, keeping everyone safe with a smile and always friendly things to say. I had no issue going for a coconut poolside while my teen was running around the park trying every ride. She came back and told me she now knew all the staff and had had friendly chit chat with each. She then decided to introduce me. Anyway, it was just her and me for a bounding time. We had the most amazing day. And the fact that it was discounted because of covid made it even better",5,2021-04-16
kuta,Waterbom_Bali,"The best waterbom ever! They offer pool for everybody, you can go there and enjoy your day even when you're with baby. During the pandemic they have special discount, and don't worry about cleanliness, they do it with all their heart!!",5,2021-03-17
kuta,Waterbom_Bali,"I was surprised to learn how much it cost to visit this place. Around 200k for local adult. However, i find that inside there are a lot of trained staffs and they keep the place clean and tidy. The slides and attractions is also worth it for the admission fee. However, the layout of this place is really confusing for me",5,2021-01-19
kuta,Waterbom_Bali,"Just come here to having outing with team in my workplaces, the place beautiful with many pool and games, so happy, staff bit lazy and the food for buffet need upgrade.",4,2020-12-20
kuta,Waterbom_Bali,"A nice place for family recreation, nice amd kindly staff and good food. Lazy river our favourite spot",5,2020-09-21
kuta,Waterbom_Bali,"Climax and Boomerang is the best slide, especially the climax one. i need to take like 10 minutes upstairs until i finally made it and it was super fun. Their staff also very friendly. I forget the name of the guy (public area i think) in lady locker who is helping me to fix my key without even asking, thanks a lot to him.",5,2020-08-22
kuta,Waterbom_Bali,We had fun with our kids. Everything was orderly and easy to locate. Getting here can be bad when stuck in traffic.,4,2020-06-21
kuta,Waterbom_Bali,"Amazing experience, thrilling slides. Food inside was a bit pricey but tasty. Easily one of our best days in Bali.",5,2020-06-14
kuta,Waterbom_Bali,"One of the better water parks I have visited, Good mixture of rides, and very helpful staffs. I bought tickets at entry which turned out to be costlier than the rate at which they sell online.",4,2020-06-12
kuta,Waterbom_Bali,"As we were unable to attend Waterbom Park due to not being able to enter the country I attempted to contact Waterbom Park to see if they would refund or credit the $450 I paid for my family and a shelter for the day.    I received no communication back until they asked me how I enjoyed my time at Waterbom Park and asked me to fill out a survey.Very poor form Waterbom, is that classed as salt into the wound?",1,2020-05-13
kuta,Waterbom_Bali,"Its been many years since a visit to Waterbom in Bali - what a transformation! Super impressed with the whole experience - booked online, with meals and towels included in the package. Electronic wrist bands to access food and drinks, great facilities for any age group and an awesome array of activities - all infrastructure and equipment in great condition. Way better than I remembered or expected - well done Waterbom - we'll be back.",5,2020-03-17
kuta,Waterbom_Bali,"We visited here on our honeymoon, it was a really fun day, there's lots to do and we really enjoyed the Lazy River and Pool Bar,  would highly recommend, there is a kids pool which was separate from the main pool which meant it was a bit quieter by the main pool which had chilled music playing all day. We purchased the tickets online in advance which were slightly cheaper.",5,2020-03-14
kuta,Waterbom_Bali,Excellent experience at waterbom. I loved the lazy River and my kids enjoyed the slides. Recommend for family's,4,2020-03-14
kuta,Waterbom_Bali,"Awesome water park with so much varietyof slides and pools, food was excellent and price was really good.",5,2020-03-14
kuta,Waterbom_Bali,"My partner and I had the BEST time at Waterbom yesterday. The entire park is immaculately clean, hygienic and organized to a tee! The food was so great and well priced - I really appreciate how environmentally friendly it was too - the food served on banana leaves (including the little dipping sauces). The smoothie I had was the best I’ve ever had anywhere! The slides were so much fun. And safe!! The staff were all so attentive and friendly and professional. Amazing. The showers and toilets were so clean and nothing like other public pools I’ve been to anywhere in the world. The lazy river was so awesome and relaxing. I don’t have kids but I could see so many great rides and pools for the kids to enjoy! I could not speak more highly of the experience we had. People should not complain about the entrance fee and costs of food and drink etc. (my amazing hot dog chips and onion rings was 85k - it’s cheap!!) We pay a LOT more in Australia for our water theme parks and this one is just as if not more deserving to warrant the entrance fee it charges. It’s a bargain in my opinion!! Especially if you pay online before you go. We are so lucky as tourists to have the Balinese people provide us with places like this one. They truly are beautiful, hospitable people. Thank you very much. Ps - it would be nice if people would refrain from smoking cigarettes whilst there - seeing as there are kids around. They wouldn’t get away with it in Australia so it sucks that they think it’s ok to do it here. There definitely are certain groups of Australians that give us a bad name in Bali. I’ll leave it there ...",5,2020-03-13
kuta,Waterbom_Bali,"A must do if you are visiting Bali, great fun , and value for money, very clean and beautiful surroundings",5,2020-03-13
kuta,Waterbom_Bali,"There weren’t many slides that my 4yo could do with an adult, she did enjoy the kiddie slides though and was able to go on one big slide, the one with the big yellow tube thing. We all enjoyed the lazy river. The kids water playground was great",4,2020-03-13
kuta,Waterbom_Bali,"Booked online 6 weeks ago in Australia to visit Waterbom Park in Bali, we use to take the Kids there many years ago.... well my wife and I who recently celebrated of 36 year of marriage decide we would go there and hire a cabana for a measly $30 + entrance fee. What a day doing the slides, casual floating on a tide around the park, having lunch brought to you with a Bintang. The staff are great and very helpful, would recommend to everyone, it gets better every time you go there.",5,2020-03-12
kuta,Waterbom_Bali,Overall a great day out. Drinks are expensive for tourists (even for an amusement park) so don't plan on a boozy water park fun time.Rides are good fun and lines move steadily.Not much for extreme thrills but enough to keep it interesting and convince the less adventurous to have a go.,5,2020-03-12
kuta,Waterbom_Bali,"Was cool trip to water boom. But, it was too expensive for the entrance ticket especially for local! If water boom can give friendly price for the entrance I think will be even more people visit  especially local.",3,2020-03-11
kuta,Satria_Gatotkaca_Statue,"I love the view of satria gatotkaca in the night, so beautiful they have water splash and beautiful colours  lights in the night changing every second",5,2020-10-03
kuta,Satria_Gatotkaca_Statue,"This is a magnificent statue just after leaving the airport and at the start of the road onto Tuban and Kuta area , it is quite stunning with the carved worriers and horses.  A must see and at night time the lighting is something else...",4,2020-05-28
kuta,Satria_Gatotkaca_Statue,"Please do not miss this statue a wonderful work of art in the middle of the city ,you will pass it on your way to the airport.",5,2020-03-22
kuta,Satria_Gatotkaca_Statue,Wow just beautiful and the detail is magnificent.  Shame we dont have stuff like this in Australia.  Loved this a must see,5,2020-03-20
kuta,Satria_Gatotkaca_Statue,You will see this statue a lot in Kuta.  It’s been here for years and I always look forward to seeing it.,5,2020-02-29
kuta,Satria_Gatotkaca_Statue,Absolutely beautiful statue.  Makes for a lovely photo if you can get your driver to pull over and let you out to take the pic.  Bali has this and many more spectacular statues around the city.,4,2020-01-21
kuta,Pandawa_Beach,"This beach is less crowded and cleaner from kuta beach, there is many good restaurant  near the area too.",5,2021-08-30
kuta,Pandawa_Beach,"Good beach but quite empty, not much option for food and beach club to stay at. But still very enjoyable white sands clear blue water.",4,2021-08-17
kuta,Pandawa_Beach,First visit when all were still natural and only view people selling french fries and coconut back in 2014. But then everything so commercialized and turned this beautiful beach in to market. So sad!!!!!!,1,2021-06-30
kuta,Pandawa_Beach,"One of beautiful white sand beach at indonesia. The ambience is still quiet, serene and clean. Must visit place with friends or family",5,2021-02-10
kuta,Pandawa_Beach,"Pandawa beach is one of my favorite renowned white sand beaches in southern bali.The local community is more familiar with the name Kutuh beach. You need to pay an entrance fee. You will pass a road flanked by steep rocky cliffs. You could see a status of Panca Pandawa taken from the Mahabrata story. Therefore the beach is called Pandawa Beach Bali.From the top fo the cliff, you will see an amazing the Indian ocean view. Pandawa beach is very famous as one of the secret beaches in bali among foreign visitors around year 2000 and it was considered Bali's secret coast. Since the year 2012, I could say Pandawa beach is wide open to more public and no longer one of blai hidden beaches, but still it is a lovely beach with an amazing ocean view.Over all, Pandawa beach offers a tremendous ocean view. Enjoy!",4,2021-01-29
kuta,Pandawa_Beach,"Nice Clean Beach (could be cleaner), quite far from Kuta but worth the travel. not so many attraction nearby though.",4,2021-01-12
kuta,Pandawa_Beach,"Had a wonderful day. Thanks to our wonderful guide. Pandawa beach is an amazing place to spend a lazy afternoon. Golden sand, clean blue ocean and fresh coconut water from cafe on the beach was so cheap (we payed 25k rupiah).",5,2020-10-30
kuta,Pandawa_Beach,I highly recommend you to take your own transport if you dont want to spend a lot at local drivers since its not easy to get a cab or more like impossible!Lovely place with a lot of amenities and instagramable spots!enjoy your day over there!,5,2020-09-13
kuta,Pandawa_Beach,"We came here by scooter from Nusa Dua. It was a ""long trip"" from our hotel but it is nice also to see how people live out the hotel and tourism zone. When you arrive at Pandawa Beach you need to pay access and it it 15.000 Rp each person its 0.80 cents Euro.. When you arrive down at the beach you have many beach clubs. We went to the Roosterfish that I really recommend for his good food and good service.The sea is here beautiful and the view is also amazing.",4,2020-03-21
kuta,Pandawa_Beach,Its a good beach with proper access. The beach is quite clean and has a line of restaurants and shops along the beach. There are umbrellas and seats on the beach which can be rented for ~50k.The viewpoint from the top is very good. Its not secluded and decently crowded.,4,2020-03-21
kuta,Pandawa_Beach,"This is a nice beach to relax south on nusa dua. Can spend the day there and enjoy doing nothing, swimming and tanning..",4,2020-03-06
kuta,Pandawa_Beach,"I visited this place twice, 1st time was in 2017, my 2nd time was just recently in Feb 2020. Back in 2017,  i was told that this beach is just open to public 1 year ago (2016). It was breathtaking, the colours of the ocean were spectacular. In 2020 I decided to come back again, it was already crowded (despite of the reduced numbers of visitors due to Coronavirus) and more tourist facilities are erected. I was just a bit disappointed of how the waters are not as clear as before (not sure is it because of the season or mass-tourism effect). But I enjoyed the water activity here i.e kayaking. This beach is also wayyy better than Nusa Dua.",4,2020-03-02
kuta,Pandawa_Beach,"This beach is on of the to attractions for people visiting bali. We spent atleast 2 hours here. Its a huge beach, dont forget to carry extra clothes if you plan to take a dip into the waters.",5,2020-03-01
kuta,Pandawa_Beach,"Wow. This has changed beyond compare to our last visit. BUT we really enjoyed our morning there. Heaving with people, but the statues should be looked at, and a long walk around. It really is a must do place",5,2020-02-27
kuta,Pandawa_Beach,"It's so wonderful . Beautiful rock cliff, beach, and view. It was the first time for me to see the white sands here I hope I can come there again oneday.",5,2020-02-25
kuta,Pandawa_Beach,"Colors of beach are really awesome.. but entry and exit is not easy to sea.. Suddenly sea is so deep.. and wawe so strong.. you couldn’t control your foot.. but sand, sea and panorama are so beautiful .. there are warungs around to eat and drink.. shower at the beach is free.. I advice..",4,2020-02-24
kuta,Pandawa_Beach,Best beach in south Bali. So lively and beautiful.Spend at least one beautiful evening here and you won't regret!,5,2020-02-23
kuta,Pandawa_Beach,We visited here nice and easy to get to nice beach some good places to eat on the beach we enjoyed sea ok to swim in,4,2020-02-21
kuta,Pandawa_Beach,One of clean beach i’ve ever visited.It was quite far from the downtown and you have to rent the chair only for see the waves.,4,2020-02-17
kuta,Pandawa_Beach,I went with my husband and we had a good time. The surf was great too. Too bad it was a bit far from where we stayed.,4,2020-02-13
kuta,Pandawa_Beach,Entrance 15.000rup.per person.Many sunbeds and umbrella to the beach for to rent (about 50.000rup).Good beach for swimming and serfing.,3,2020-02-13
kuta,Pandawa_Beach,What a beach it is guys. Must visit place. atmosphere is very good. Clean water and white sand beach location is very good. You find Mahabharata pandav’s temple also on beach.Thanks for reading.,5,2020-01-30
kuta,Pandawa_Beach,"Let the sun kiss you and enjoy the virgin beach. About one hour from Kuta area, but for another information bring your own vehicle or scooter because online taxi can't entry this area",4,2020-01-20
kuta,Pandawa_Beach,"I do not know what good this beach is. A lot of tourists, big enough waves, would not recommend tourists with children. Once you can come, put a mark and take a couple of photos. I would recommend smaller beaches nearby.",3,2020-01-18
kuta,Pandawa_Beach,This is Trap!!! It is not a beach but office!! Why are you guys make a fake information??? This is so biased! Such a waste of time!,1,2020-01-15
kuta,Pandawa_Beach,"This beach is located at the base of a former massive limestone quarry which you have to pay to get into RP65,000 (two adults and parking). The beach is nice enough and if you wander past the many warungs it even gets quiet. Overall it is now an inflated tourist trap including a Hollywood style sign in the hills. But for us, as geologists, it was quite a cool setting.",3,2020-01-12
kuta,Pandawa_Beach,"Me and my friend visited pandawa beach,the beach is very clean with a bottle of beer staring at the sunset,the local people are very helpful with adequate admission prices.",5,2020-01-10
kuta,Pandawa_Beach,"I read reviews of this beach and the words used to describe it was “pristine”, “gem of a place” etc. you get the picture. Hence we were excited to go visit this beach. Lo and behold the absolute disappointment the moment we hit the shores (had to walk past the rows of establishments sprung up to capture the tourist dollar). Beach was dirty, overcrowded and had a lack of public amenities (I don’t count those toilets set up by commercial establishments and which are also dirty as public amenities). The water was also not clear so I’m really unsure how adjectives such as pristine could be used to describe it.",1,2020-01-10
kuta,Pandawa_Beach,"The food are all small stalls and looked a bit unkempt. But I appreciate the similar looks and price, like all the stalls offering almost the same stuffs with the exactly same price, for example french fries, 25,000 ids (1,5 usd approx) etc. No place to have decent showers, only places that looked a bit dirty so I washed my children feet and hands at the free shower poles. Also no place to hide under the suns, no coconut trees, if want to hide from the sun have to buy drinks at the food stall. The sand is clean. My children liked to play there at 12-13 at noon. Very hot but very happy... for them playing sand",4,2020-01-03
kuta,Beachwalk_Shopping_Center,"In my opinion, Beach Walk is the best shopping center in Bali. It has a very beautiful architecture. This shopping center is located right in front of the sea and near kuta. In addition to the shops on the top floor, there are many cinemas that you can enjoy watching movies and animations and ... and eating popcorn !!",5,2021-09-18
